Product Url,Image,Image1,Image2,Image3,Vendor,Sku Styleisnow,Season,Year,SKU,Variant,Color detail,Color Supplier,Made in,Material,Product's Title,Description,Tags,Qty,Retail Price,Discount,Size Info,Size,Qty Detail,Bag length,Bag height,Bag width,Handle height,Shoulder bag length,Belt length,Belt height,Accessory length,Accessory height,Accessory weight,Heel height,Plateau height,Barcode,Compare to Price,Dimensions
https://www.styleisnow.com/business/handbags-brunello-cucinelli-242026abs000003-c9593.html,,http://cdn.orderlink.it/foto/242026MBDLD2499/MBDLD2499zcb-13.jpg,http://cdn.orderlink.it/foto/242026MBDLD2499/MBDLD2499euy-14.jpg,http://cdn.orderlink.it/foto/242026MBDLD2499/MBDLD2499axi-15.jpg,BRUNELLO CUCINELLI,242026ABS000003-C9593,Fall - Winter,2024,MBDLD2499,C9593,Grigio,QUARZO,Italy,100% calf leather,Handbag With Precious Bands,"Brunello Cucinelli handbag crafted in fine suede and enriched by embroidered monili inserts, which embrace the sides of the bag with a brilliant effect. Magnetic closure and leather interior with a detachable open pocket. Top handle, matching adjustable and removable shoulder strap. Ruthenium-finished metalware.",Woman > Bags > Handbags,1.0,3210.0,35.00%,-,os,1,20 cm,17 cm,"8,5 cm",10 cm,0,,,,,,0,,0,2210.0,"H 17.0 cm x L 20.0 x D 8.5 cm / H 6.7"" x L 7.9"" x D 3.3"""
https://www.styleisnow.com/business/handbags-tod-s-242727abs000015-b999.html,,http://cdn.orderlink.it/foto/242727XBWAQBH0200YAT/XBWAQBH0200YATgwu-13.jpg,http://cdn.orderlink.it/foto/242727XBWAQBH0200YAT/XBWAQBH0200YATdfw-14.jpg,http://cdn.orderlink.it/foto/242727XBWAQBH0200YAT/XBWAQBH0200YATbly-15.jpg,TOD'S,242727ABS000015-B999,Fall - Winter,2024,XBWAQBH0200YAT,B999,Nero,NERO,Italy,100% calfskin,Smooth Leather Darsena Handbag,"The Tod's Darsena handbag is made of fine natural grain leather, featuring essential and feminine lines and a zip closure with two pulls that are hidden by leather inserts. It has a double tubular handle, an embossed logo on the front, a lock with protective case, and a lined interior with one zip pocket and one open pocket. It also comes with an adjustable leather shoulder strap. The metallic accessories have a silver finish.",Woman > Bags > Handbags,1.0,2825.0,35.00%,-,os,1,29 cm,14 cm,"13,5 cm",11 cm,0,,,,,,0,,0,1950.0,"H 14.0 cm x L 29.0 x D 13.5 cm / H 5.5"" x L 11.4"" x D 5.3"""
https://www.styleisnow.com/business/handbags-longchamp-242360abs000006-037.html,,http://cdn.orderlink.it/foto/24236010259HSG/10259HSGysy-13.jpg,http://cdn.orderlink.it/foto/24236010259HSG/10259HSGwyz-14.jpg,http://cdn.orderlink.it/foto/24236010259HSG/10259HSGito-15.jpg,LONGCHAMP,242360ABS000006-037,Fall - Winter,2024,10259HSG,037,Neutro,GREGGIO,China,"100% CO, 100% leather","""Xs Essential Handbag""",The XS Essential handbag by Longchamp is made of cotton canvas with a rubberized logo lettering and leather base and handles. It features a snap button closure and an unlined interior with a zip pocket. The adjustable and removable leather shoulder strap and silver metal hardware add a touch of elegance to this bag.,Woman > Bags > Handbags,29.0,435.0,23.00%,-,os,29,19 cm,17 cm,8 cm,8 cm,0,,,,,,0,,0,300.0,"H 17.0 cm x L 19.0 x D 8.0 cm / H 6.7"" x L 7.5"" x D 3.1"""
https://www.styleisnow.com/business/mini-bags-stella-mccartney-242608abs000023-6500g.html,,http://cdn.orderlink.it/foto/242608391698WP0301/391698WP0301zyx-13.jpg,http://cdn.orderlink.it/foto/242608391698WP0301/391698WP0301cbl-14.jpg,http://cdn.orderlink.it/foto/242608391698WP0301/391698WP0301stk-15.jpg,STELLA MCCARTNEY,242608ABS000023-6500G,Fall - Winter,2024,391698 WP0301,6500G,Marrone,GIPSY RED,Italy,100% PL,Falabella Tiny Handbag,"The Falabella bag by Stella McCartney is made of eco-leather and features a double handle, chain shoulder strap, and chain trimmings with a branded medallion. It has an internal snap button closure, logo-printed nylon lining, and an applied inner pocket. Silver-tone metalware.",Woman > Bags > Mini bags,1.0,965.0,25.00%,-,os,1,18 cm,"17,5 cm",5 cm,8 cm,0,,,,,,0,,0,660.0,"H 17.5 cm x L 18.0 x D 5.0 cm / H 6.9"" x L 7.1"" x D 2.0"""
https://www.styleisnow.com/business/handbags-giuseppe-di-morabito-242a04abs000001-99.html,,http://cdn.orderlink.it/foto/242A0403PFBG002FC016/03PFBG002FC016ugy-13.jpg,http://cdn.orderlink.it/foto/242A0403PFBG002FC016/03PFBG002FC016uai-14.jpg,http://cdn.orderlink.it/foto/242A0403PFBG002FC016/03PFBG002FC016qhr-15.jpg,GIUSEPPE DI MORABITO,242A04ABS000001-99,Fall - Winter,2024,03PFBG002FC 016,99,Nero,BLACK,Italy,100% leather,Handbag With Crystals,"The Giuseppe Di Morabito handbag is made of suede leather and embellished with all-over crystal studs. The asymmetrical handles allow for a knot closure, while the interior is lined for added durability.",Woman > Bags > Handbags,2.0,755.0,30.00%,-,os,2,22 cm,15 cm,13 cm,9 cm,0,,,,,,0,,0,520.0,"H 15.0 cm x L 22.0 x D 13.0 cm / H 5.9"" x L 8.7"" x D 5.1"""
https://www.styleisnow.com/business/handbags-tod-s-242727abs000015-s417.html,,http://cdn.orderlink.it/foto/242727XBWAQBH0200YAT/XBWAQBH0200YATgbi-13.jpg,http://cdn.orderlink.it/foto/242727XBWAQBH0200YAT/XBWAQBH0200YATleb-14.jpg,http://cdn.orderlink.it/foto/242727XBWAQBH0200YAT/XBWAQBH0200YATopo-15.jpg,TOD'S,242727ABS000015-S417,Fall - Winter,2024,XBWAQBH0200YAT,S417,Neutro,DULL GOLD,Italy,100% calfskin,Smooth Leather Darsena Handbag,"The Tod's Darsena handbag is made of fine natural grain leather, featuring essential and feminine lines and a zip closure with two pulls that are hidden by leather inserts. It has a double tubular handle, an embossed logo on the front, a lock with protective case, and a lined interior with one zip pocket and one open pocket. It also comes with an adjustable leather shoulder strap. The metallic accessories have a silver finish.",Woman > Bags > Handbags,2.0,2825.0,35.00%,-,os,2,29 cm,14 cm,"13,5 cm",11 cm,0,,,,,,0,,0,1950.0,"H 14.0 cm x L 29.0 x D 13.5 cm / H 5.5"" x L 11.4"" x D 5.3"""
https://www.styleisnow.com/business/mini-bags-ganni-242671abs000021-766.html,,http://cdn.orderlink.it/foto/242671A6085/A6085zfk-13.jpg,http://cdn.orderlink.it/foto/242671A6085/A6085xzc-14.jpg,http://cdn.orderlink.it/foto/242671A6085/A6085vfn-15.jpg,GANNI,242671ABS000021-766,Fall - Winter,2024,A6085,766,Celeste,DUSTY BLUE,China,65% rec leather 19% PU 16% PES,Bou Handbag,"Bou handbag from GANNI made of recycled leather and featuring a hexagonal shape and woven handle with gold metal detail. Tone-on-tone Butterfly logo, magnetic closure with two separate compartments, one with a credit card slot, and adjustable, detachable shoulder strap.",Woman > Bags > Handbags,1.0,505.0,35.00%,-,os,1,20 cm,16 cm,16 cm,6 cm,0,,,,,,0,,0,350.0,"H 16.0 cm x L 20.0 x D 16.0 cm / H 6.3"" x L 7.9"" x D 6.3"""
https://www.styleisnow.com/business/handbags-ganni-242671abs000028-943.html,,http://cdn.orderlink.it/foto/242671A6494/A6494cwh-13.jpg,http://cdn.orderlink.it/foto/242671A6494/A6494jwh-14.jpg,http://cdn.orderlink.it/foto/242671A6494/A6494rhf-15.jpg,GANNI,242671ABS000028-943,Fall - Winter,2024,A6494,943,Marrone,LEOPARD,China,65% rec leather 19% PU 16% PES,Bou Handbag,"Bou handbag from GANNI made of animal-print recycled leather and featuring a hexagonal shape and woven handle with gold metal detail. Tone-on-tone Butterfly logo, magnetic closure with two separate compartments, one with a credit card slot, and adjustable, detachable shoulder strap.",Woman > Bags > Handbags,4.0,545.0,35.00%,-,os,4,20 cm,16 cm,16 cm,6 cm,0,,,,,,0,,0,380.0,"H 16.0 cm x L 20.0 x D 16.0 cm / H 6.3"" x L 7.9"" x D 6.3"""
https://www.styleisnow.com/business/handbags-brunello-cucinelli-242026abs000008-c8279.html,,http://cdn.orderlink.it/foto/242026MBGPD3611/MBGPD3611lnt-13.jpg,http://cdn.orderlink.it/foto/242026MBGPD3611/MBGPD3611auo-14.jpg,http://cdn.orderlink.it/foto/242026MBGPD3611/MBGPD3611ssw-15.jpg,BRUNELLO CUCINELLI,242026ABS000008-C8279,Fall - Winter,2024,MBGPD3611,C8279,Marrone,TESTA MORO,Italy,100% lamb leather,Handbag With Monile Embell,"This Brunello Cucinelli handbag is made of soft leather with a drawstring closure and iconic Monile detail. The interior is lined with suede and features a zip pocket, adjustable and removable shoulder strap, and metallic accessories in a ruthenium finish.",Woman > Bags > Handbags,1.0,4235.0,35.00%,-,os,1,26 cm,25 cm,14 cm,14 cm,0,,,,,,0,,0,2920.0,"H 25.0 cm x L 26.0 x D 14.0 cm / H 9.8"" x L 10.2"" x D 5.5"""
https://www.styleisnow.com/business/handbags-brunello-cucinelli-242026abs000008-c101.html,,http://cdn.orderlink.it/foto/242026MBGPD3611/MBGPD3611vta-13.jpg,http://cdn.orderlink.it/foto/242026MBGPD3611/MBGPD3611sfp-14.jpg,http://cdn.orderlink.it/foto/242026MBGPD3611/MBGPD3611wph-15.jpg,BRUNELLO CUCINELLI,242026ABS000008-C101,Fall - Winter,2024,MBGPD3611,C101,Nero,NERO,Italy,100% lamb leather,Handbag With Monile Embell,"This Brunello Cucinelli handbag is made of soft leather with a drawstring closure and iconic Monile detail. The interior is lined with suede and features a zip pocket, adjustable and removable shoulder strap, and metallic accessories in a ruthenium finish.",Woman > Bags > Handbags,1.0,4235.0,35.00%,-,os,1,26 cm,25 cm,14 cm,14 cm,0,,,,,,0,,0,2920.0,"H 25.0 cm x L 26.0 x D 14.0 cm / H 9.8"" x L 10.2"" x D 5.5"""
