Product Url,Image,Image1,Image2,Image3,Vendor,Sku Styleisnow,Season,Year,SKU,Variant,Color detail,Color Supplier,Made in,Material,Product's Title,Description,Tags,Qty,Retail Price,Discount,Size Info,Size,Qty Detail,Handle height,Shoulder bag length,Belt length,Belt height,Accessory length,Accessory height,Accessory weight,Heel height,Plateau height,Barcode,Compare to Price,Qty_Detail,SKU FULL
https://www.styleisnow.com/business/face-dr-barbara-sturm-ogg335oby000009-vabb.html,,,,,DR BARBARA STURM,OGG335OBY000009-VABB,Spring - Summer,20OG,08 100 17,VABB,,VARIANTE ABBINATA,Germany,0,Beauty Face Cream Rich 50 Ml,"Dr. Barbara Sturm’s FACE CREAM RICH is a richer version of FACE CREAM. Purslane, a key active ingredient, and potent antioxidants absorb quickly into the skin to soothe and calm while strengthening the sensitive skin membrane against free radicals and promoting skin health and function. After applying this anti-aging cream, your skin will appear firmer and visibly refreshed. Perfect for more mature skin or complexions that need extra hydration during the winter months. It’s also suitable as a day cream for demanding or dry skin.After using the CLEANSER, apply FACE CREAM RICH to the face, neck, décolleté as well as the delicate eye area.Composition: Aqua/Water/Eau, Octyldodecanol, Urea, Glycerin, Butyrospermum Parkii (Shea) Butter, Decyl Oleate, Zea Mays (Corn) Germ Oil, C12-15 Alkyl Benzoate, Cetearyl Alcohol, Hydrogenated Vegetable Glycerides, Vitis Vinifera (Grape) Seed Oil, Lactobacillus/Portulaca Oleracea Ferment Extract, Persea Gratissima (Avocado) Oil, Sorbitol, Propanediol, Potassium Cetyl Phosphate, Tocopheryl Acetate, Dimethicone, Phytosterols, Panthenol, Olea Europaea (Olive) Fruit Oil, Leuconostoc/Radish Root Ferment Filtrate, Baicalin, Phenoxyethanol, Hydrogenated Palm Glycerides, Carbomer, Xanthan Gum, Ethylhexylglycerin, Potassium Sorbate, Alcohol, Caprylic/Capric Triglyceride, Ascorbyl Palmitate, Pantolactone, Citric Acid, Ascorbic Acid.&nbsp ",Beauty and Lifestyle > Beauty > Face,6,210.0,20.00%,-,os,7,0,0,0,0,0,0,0,0,0,0,150.0,7,OGG335OBY000009-VABB-os
https://www.styleisnow.com/business/body-aesop-ogg194oby000029-vabb.html,,http://cdn.orderlink.it/foto/OGG194B500BM13/B500BM13pbm-13.jpg,,,AESOP,OGG194OBY000029-VABB,Spring - Summer,20OG,B500BM13,VABB,,VARIANTE ABBINATA,Australia,0,'Reverence Aromatique' Hand Balm - 500Ml,"Aesop's hand cream rich in soothing ingredients such as Potassium Lactate, Bergamot Peel, Vetiver Root, Petitgrain, which give rich moisture to tired hands and cuticles. Ingredients: Water (Aqua), Glycerin, Prunus Amygdalus Dulcis (Sweet Almond) Oil, Stearic Acid, Cetearyl Alcohol, Ceteareth-20, Cocos Nucifera (Coconut) Oil, Macadamia Ternifolia Seed Oil, Citrus Nobilis (Mandarin Orange) Peel Oil, Glyceryl Stearate, Cedrus Atlantica (Cedarwood) Bark Oil, Aloe Barbadensis Leaf Juice, Lavandula Angustifolia (Lavender) Oil, Butyrospermum Parkii (Shea Butter), Theobroma Cacao (Cocoa) Seed Butter, Citrus Aurantium Dulcis (Orange) Oil, Tocopherol, Helianthus Annuus (Sunflower) Seed Oil, Phenoxyethanol, Rosmarinus Officinalis (Rosemary) Leaf Oil, Citrus Grandis (Grapefruit) Seed Extract, Triticum Vulgare (Wheat) Germ Oil, Glycine Soja (Soybean) Oil, Disodium EDTA, Sodium Citrate, Daucus Carota Sativa (Carrot) Root Extract, Beta-Carotene, d-Limonene, Linalool.",Beauty and Lifestyle > Beauty > Body,20,120.0,26.88%,-,os,17,0,0,0,0,0,0,0,0,0,0,80.0,17,OGG194OBY000029-VABB-os
https://www.styleisnow.com/business/body-aesop-ogg194oby000040-vabb.html,,http://cdn.orderlink.it/foto/OGG194B500BM06/B500BM06aik-13.jpg,,,AESOP,OGG194OBY000040-VABB,Spring - Summer,20OG,B500BM06,VABB,,VARIANTE ABBINATA,Australia,0,'Resurrection Aromatique' Hand Balm - 500Ml,"Aesop's hand balm enriched with plant extracts and tangerine zest, rosemary, and atlas cedar three moisturings to hands and cuticles. Ingredients: Water (Aqua), Glycerin, Prunus Amygdalus Dulcis (Sweet Almond) Oil, Stearic Acid, Cetearyl Alcohol, Ceteareth-20, Cocos Nucifera (Coconut) Oil, Macadamia Ternifolia Seed Oil, Citrus Nobilis (Mandarin Orange) Peel Oil, Glyceryl Stearate, Cedrus Atlantica (Cedarwood) Bark Oil, Aloe Barbadensis Leaf Juice, Lavandula Angustifolia (Lavender) Oil, Butyrospermum Parkii (Shea Butter), Theobroma Cacao (Cocoa) Seed Butter, Citrus Aurantium Dulcis (Orange) Oil, Tocopherol, Helianthus Annuus (Sunflower) Seed Oil, Phenoxyethanol, Rosmarinus Officinalis (Rosemary) Leaf Oil, Citrus Grandis (Grapefruit) Seed Extract, Triticum Vulgare (Wheat) Germ Oil, Glycine Soja (Soybean) Oil, Disodium EDTA, Sodium Citrate, Daucus Carota Sativa (Carrot) Root Extract, Beta-Carotene, d-Limonene, Linalool.",Beauty and Lifestyle > Beauty > Body,16,120.0,26.88%,-,os,10,0,0,0,0,0,0,0,0,0,0,80.0,10,OGG194OBY000040-VABB-os
https://www.styleisnow.com/business/bermudas-and-shorts-golden-goose-241571ube000001-blkwt.html,http://cdn.orderlink.it/foto/221571GMP00878P000532/GMP00878P000532kyh-20.jpg,http://cdn.orderlink.it/foto/221571GMP00878P000532/GMP00878P000532vcj-13.jpg,http://cdn.orderlink.it/foto/221571GMP00878P000532/GMP00878P000532xmg-14.jpg,http://cdn.orderlink.it/foto/221571GMP00878P000532/GMP00878P000532tjv-15.jpg,GOLDEN GOOSE,241571UBE000001-BLKWT,Spring - Summer,2024,GMP00878 P000532,BLKWT,Nero,BLACK WHITE,Italy,100% cotone,Diego Star Short Sweatpants,"Diego short sweatpants in cotton jersey from the Star collection by Golden Goose. Detailed with contrast white stars on the sides. Wide leg cut, elasticated waist with internal drawstring, side pockets, one rear patch pocket. The model is 185 cm tall and wears a size M.",Man > Clothing > Trousers > Bermudas and Shorts,4,295.0,47.00%,-,xl,"1,1,2,2,0,0,0,0,0,0,0,0",,,,,,,,0,,8050235165427,200.0,2,241571UBE000001-BLKWT-xl
https://www.styleisnow.com/business/trench-coats-and-rain-coats-herno-laminar-241397uim000001-9201.html,http://cdn.orderlink.it/foto/241397IM00064UL11124/IM00064UL11124cdc-20.jpg,http://cdn.orderlink.it/foto/241397IM00064UL11124/IM00064UL11124jkj-13.jpg,http://cdn.orderlink.it/foto/241397IM00064UL11124/IM00064UL11124jdu-14.jpg,http://cdn.orderlink.it/foto/241397IM00064UL11124/IM00064UL11124fsh-15.jpg,HERNO LAMINAR,241397UIM000001-9201,Spring - Summer,2024,IM00064UL 11124,9201,Blu,BLU,Moldova,100%PL,Laminar Carcoat In Gore-Tex 2L,"Trench coat from the Laminar collection by Herno, made of Gore-Tex Paclite Shell 2L, a waterproof, windproof and breathable technical fabric. Carcoat design featuring concealed double-slider zip and snap fastening, pointed collar with hook-and-eye, adjustable and removable hood, welt pockets, one of which with internal zipped compartment, internal windproof cuffs in technical jersey, center back vent. Provided with one pocket and taped seams on the inside, logo detail printed on the edge of the hood. Regular fit with midi length. The model is 187 cm tall and wears a size IT 48.",Man > Clothing > Outerwear > Trench coats and Rain coats,1,965.0,48.00%,IT,52,"0,0,0,0,1,2,1,0,0,0,0,0",,,,,,,,0,,8055721923055,660.0,2,241397UIM000001-9201-52
https://www.styleisnow.com/business/sneakers-new-balance-241321xsn000039-lgtan.html,,http://cdn.orderlink.it/foto/241321ML610TML/ML610TMLbmz-13.jpg,http://cdn.orderlink.it/foto/241321ML610TML/ML610TMLhmf-14.jpg,http://cdn.orderlink.it/foto/241321ML610TML/ML610TMLxdc-16.jpg,NEW BALANCE,241321XSN000039-LGTAN,Spring - Summer,2024,ML610TML,LGTAN,Beige,LIGHT TAN,Indonesia,100%leather 100%TR,Sneakers,"The New Balance 610 sneakers are made of technical fabric with suede leather inserts and iconic rubber N logos on the sides. They feature a leather patch on the tongue and side, a pull tab at the back, and a fabric interior with a removable insole. The C-CAP cushioning and N-Durance rubber sole provide excellent support and durability. These sneakers also come with spare laces for added convenience.",Unisex > Calzature unisex > Sneakers,1,165.0,40.00%,UNISEX,43,"0,0,1,0,0,1,0,2,0,1,1,2,0,0,0,1,2,0,0,0,0,0,0,0,0",,,,,,,,"40.0 mm / 1.6""",0,197376178249,120.0,2,241321XSN000039-LGTAN-43
https://www.styleisnow.com/business/sneakers-new-balance-241321xsn000018-whtgn.html,,http://cdn.orderlink.it/foto/241321BB550DOB/BB550DOByjj-13.jpg,http://cdn.orderlink.it/foto/241321BB550DOB/BB550DOBxzm-14.jpg,http://cdn.orderlink.it/foto/241321BB550DOB/BB550DOBeop-16.jpg,NEW BALANCE,241321XSN000018-WHTGN,Spring - Summer,2024,BB550DOB,WHTGN,Bianco,WHITE GREEN,Vietnam,"100% TR, 100% leather",550 Sneakers,"New Balance 550 smooth and suede leather sneakers with side perforations, signature ""N"" inlay on the sides, contrasting ""NB"" logo print on the back and contrasting ""550"" print on the side. Padded nylon tongue with fabric logo tag, technical fabric heel tab, fabric lining with removable insole, rubber sole with side embossed logo and contrasting bottom.",Unisex > Calzature unisex > Sneakers,3,180.0,40.00%,UNISEX,43,"0,0,0,0,0,0,0,0,0,0,0,2,0,1,0,4,2,0,4,2,1,0,0,1,0",,,,,,,,"30.0 mm / 1.2""",0,197376291054,120.0,2,241321XSN000018-WHTGN-43
https://www.styleisnow.com/business/sneakers-off-white-241411nsn000007-3301.html,,http://cdn.orderlink.it/foto/241411OWIA288S24LEA001/OWIA288S24LEA001irz-13.jpg,http://cdn.orderlink.it/foto/241411OWIA288S24LEA001/OWIA288S24LEA001txc-14.jpg,http://cdn.orderlink.it/foto/241411OWIA288S24LEA001/OWIA288S24LEA001hfx-16.jpg,OFF-WHITE,241411NSN000007-3301,Spring - Summer,2024,OWIA288S24LEA001,3301,Rosa,LIGHT PINK,Indonesia,100%leather,Low Leather Vulcanized Sneakers For,"Low Off-White sneakers made of hammered leather with the iconic Arrow motif embroidered on the outer side. Removable Zip Tie tag in contrasting leather, leather logo patch on the tongue, laces with ""SHOELACES"" lettering. Leather-lined interior with removable fabric insole and rubber sole.",Woman > Shoes > Sneakers,6,500.0,42.00%,IT,38,"0,0,0,0,0,0,0,0,1,0,0,0,0,0,0,0,0,0,0,0,0,0,0,0,0,0,0,0",,,,,,,,"30.0 mm / 1.2""",0,8051594691435,350.0,1,241411NSN000007-3301-38
https://www.styleisnow.com/business/pouch-and-business-bags-salvatore-ferragamo-241400fav000005-001.html,,http://cdn.orderlink.it/foto/2414002414820769481/2414820769481dns-13.jpg,http://cdn.orderlink.it/foto/2414002414820769481/2414820769481yxq-14.jpg,http://cdn.orderlink.it/foto/2414002414820769481/2414820769481hnq-15.jpg,FERRAGAMO,241400FAV000005-001,Spring - Summer,2024,2414820769481,001,Nero,NERO,Italy,100% calf leather,Gancini P,"The FERRAGAMO pouch is made of embossed leather with Gancini and logo lettering imprinted. It features a zip closure, lined interior with two open pockets, an additional front pocket with zip, and metallic accessories in steel finish.",Man > Bags > Pouch and Business bags,2,1020.0,47.00%,-,os,2,0,0,,,,,,0,,8056283500074,700.0,2,241400FAV000005-001-os
https://www.styleisnow.com/business/t-shirts-y-3-241589uts000010-black.html,http://cdn.orderlink.it/foto/241589IN8744/IN8744plq-20.jpg,http://cdn.orderlink.it/foto/241589IN8744/IN8744otk-13.jpg,http://cdn.orderlink.it/foto/241589IN8744/IN8744eqs-14.jpg,http://cdn.orderlink.it/foto/241589IN8744/IN8744gip-15.jpg,Y-3,241589UTS000010-BLACK,Spring - Summer,2024,IN8744,BLACK,Nero,BLACK,Vietnam,86%PL 14%EA,Long-Sleeved Perforated Jersey T,"Crafted from lightweight recycled polyester technical jersey, this long-sleeved T-shirt features a faded print of the Y-3 logo on the chest and Yohji Yamamoto's signature on the back. The design is characterized by raglan shoulders, side slits at the bottom, and laser-cut edges. Regular fit. The model is 187 cm tall and wears size M.",Man > Clothing > T-Shirts and Sweatshirts > T-shirts,2,205.0,50.00%,-,s,"0,1,3,4,0,0,0,0,0,0,0,0",,,,,,,,0,,4067891904424,140.0,3,241589UTS000010-BLACK-s
https://www.styleisnow.com/business/jeans-agolde-241903dje000017-rnge.html,http://cdn.orderlink.it/foto/241903A154F1141/A154F1141gje-20.jpg,http://cdn.orderlink.it/foto/241903A154F1141/A154F1141qlq-13.jpg,http://cdn.orderlink.it/foto/241903A154F1141/A154F1141ect-14.jpg,http://cdn.orderlink.it/foto/241903A154F1141/A154F1141oln-15.jpg,AGOLDE,241903DJE000017-RNGE,Spring - Summer,2024,A154F 1141,RNGE,Blu,RANGE,Turkey,100%CO,Straight Leg Jeans From The 90'S With High Waist,"Agolde jeans made from regenerative cotton denim, featuring a vintage dark wash and a five-pocket design with a high-waisted straight cut. They have hidden logo buttons for closure and belt loops at the waist. Finished with distressed details at the hem. The model is 177 cm tall and wears a size 26.",Woman > Clothing > Jeans > Jeans,1,375.0,52.00%,JEANS,26,"0,0,1,3,5,6,5,2,0,0,0,0,0,0,0,0,0",,,,,,,,0,,193693327711,260.0,5,241903DJE000017-RNGE-26
https://www.styleisnow.com/business/jeans-agolde-241903dje000017-rnge.html,http://cdn.orderlink.it/foto/241903A154F1141/A154F1141gje-20.jpg,http://cdn.orderlink.it/foto/241903A154F1141/A154F1141qlq-13.jpg,http://cdn.orderlink.it/foto/241903A154F1141/A154F1141ect-14.jpg,http://cdn.orderlink.it/foto/241903A154F1141/A154F1141oln-15.jpg,AGOLDE,241903DJE000017-RNGE,Spring - Summer,2024,A154F 1141,RNGE,Blu,RANGE,Turkey,100%CO,Straight Leg Jeans From The 90'S With High Waist,"Agolde jeans made from regenerative cotton denim, featuring a vintage dark wash and a five-pocket design with a high-waisted straight cut. They have hidden logo buttons for closure and belt loops at the waist. Finished with distressed details at the hem. The model is 177 cm tall and wears a size 26.",Woman > Clothing > Jeans > Jeans,1,375.0,52.00%,JEANS,27,"0,0,1,3,5,6,5,2,0,0,0,0,0,0,0,0,0",,,,,,,,0,,193693327728,260.0,6,241903DJE000017-RNGE-27
https://www.styleisnow.com/business/shirts-lemaire-241898upl000001-bk999.html,http://cdn.orderlink.it/foto/241898TO1225LK116/TO1225LK116dsb-20.jpg,http://cdn.orderlink.it/foto/241898TO1225LK116/TO1225LK116hee-13.jpg,http://cdn.orderlink.it/foto/241898TO1225LK116/TO1225LK116xtc-14.jpg,http://cdn.orderlink.it/foto/241898TO1225LK116/TO1225LK116wqm-15.jpg,LEMAIRE,241898UPL000001-BK999,Spring - Summer,2024,TO1225 LK116,BK999,Nero,BLACK,Italy,100% CO,Short-Sleeved Knit Shirt For,"This Lemaire short-sleeved shirt is made of pure cotton knit and has a loose fit. It features a ribbed pointed collar, front button closure, and side slits. The model is 187 cm tall and wears size L.",Man > Clothing > Shirts,1,755.0,48.00%,-,m,"0,2,0,1,0,0,0,0,0,0,0,0",,,,,,,,0,,3666656180601,520.0,2,241898UPL000001-BK999-m
https://www.styleisnow.com/business/sandals-castaner-241652nwe000012-2017.html,,http://cdn.orderlink.it/foto/221652CHIARA8002/CHIARA8002piv-13.jpg,http://cdn.orderlink.it/foto/221652CHIARA8002/CHIARA8002acm-14.jpg,http://cdn.orderlink.it/foto/221652CHIARA8002/CHIARA8002ouh-16.jpg,CASTANER,241652NWE000012-2017,Spring - Summer,2024,CHIARA 8 002,2017,Beige,SAND,Spain,100% CO,Chiara Wedge Espadrilles,"Chiara handmade espadrilles by Castañer with front canvas V-shaped upper and contrasting heel with ribbon tied at the ankle. Wedge covered in braided rope, canvas interior, rubber sole.",Woman > Shoes > Sandals,2,135.0,48.00%,IT,38,"0,0,0,0,0,0,1,0,2,0,5,0,0,0,1,0,0,0,0,0,0,0,0,0,0,0,0,0",,,,,,,,"80.0 mm / 3.1""","1,5 cm",8434483584092,90.0,2,241652NWE000012-2017-38
https://www.styleisnow.com/business/sweatshirts-hugo-241250ufe000004-055.html,http://cdn.orderlink.it/foto/24125050473168/50473168nzs-20.jpg,http://cdn.orderlink.it/foto/24125050473168/50473168znn-13.jpg,http://cdn.orderlink.it/foto/24125050473168/50473168utm-14.jpg,http://cdn.orderlink.it/foto/24125050473168/50473168rcm-15.jpg,HUGO,241250UFE000004-055,Spring - Summer,2024,50473168,055,Grigio,LIGHT PASTEL GREY,Bangladesh,100%CO,Duratschi Sweatshirt With Box,"The Hugo Duratschi sweatshirt is made of sustainable cotton jersey with the iconic box logo printed on the chest. It features an adjustable hood with contrasting drawstring, a front kangaroo pocket, and ribbed cuffs and hem. The fit is regular. The model is 187 cm tall and wears a size L.",Man > Clothing > T-Shirts and Sweatshirts > Sweatshirts,1,140.0,52.00%,-,xl,"2,3,2,2,0,0,0,0,0,0,0,0",,,,,,,,0,,4063542094308,100.0,2,241250UFE000004-055-xl
https://www.styleisnow.com/business/coats-ganni-241671dca000004-851.html,http://cdn.orderlink.it/foto/241671F8933/F8933ogj-20.jpg,http://cdn.orderlink.it/foto/241671F8933/F8933rpk-13.jpg,http://cdn.orderlink.it/foto/241671F8933/F8933kna-14.jpg,http://cdn.orderlink.it/foto/241671F8933/F8933lvx-15.jpg,GANNI,241671DCA000004-851,Spring - Summer,2024,F8933,851,Verde,KOMBU GREEN,China,100% PA,Quilted Midi Coat,"The GANNI midi coat has a straight and wide cut, made of micro ripstop nylon with large buttoned front pockets, one of which is finished with embroidered monogram. It features a round neck, hidden snap buttons closure, side slits, and a large pleat at the back. The model is 177 cm tall and wears size S/M.",Woman > Clothing > Outerwear > Coats,2,480.0,44.00%,-,s/m,"0,0,0,0,0,1,0,0,0,0,0,0,0,0,0,0,0",,,,,,,,0,,5714667631785,330.0,1,241671DCA000004-851-s/m
https://www.styleisnow.com/business/sweatshirts-maison-kitsune-241684ufe000004-p199.html,http://cdn.orderlink.it/foto/241684LM00702KM0001/LM00702KM0001xze-20.jpg,http://cdn.orderlink.it/foto/241684LM00702KM0001/LM00702KM0001lig-13.jpg,http://cdn.orderlink.it/foto/241684LM00702KM0001/LM00702KM0001kac-14.jpg,http://cdn.orderlink.it/foto/241684LM00702KM0001/LM00702KM0001mfj-15.jpg,MAISON KITSUNE,241684UFE000004-P199,Spring - Summer,2024,LM00702KM0001,P199,Nero,BLACK,Portugal,100%CO,Fox Head Hooded Sweatshirt,"Classically designed with a drawstring hood and kangaroo pocket, this sweatshirt from Maison Kitsuné features the signature Fox Head patch embroidered at the chest. It is crafted from loopback cotton jersey to a regular fit with dropped shoulders and ribbed cuffs and hem. The model is 187 cm tall and wears a size L.",Man > Clothing > T-Shirts and Sweatshirts > Sweatshirts,4,270.0,50.00%,-,m,"0,4,3,0,0,0,0,0,0,0,0,0",,,,,,,,0,,3700794277783,190.0,4,241684UFE000004-P199-m
https://www.styleisnow.com/business/mules-dolce-gabbana-241450nsd000008-8b956.html,,http://cdn.orderlink.it/foto/241450CR1738AV799/CR1738AV799ylm-13.jpg,http://cdn.orderlink.it/foto/241450CR1738AV799/CR1738AV799kvn-14.jpg,http://cdn.orderlink.it/foto/241450CR1738AV799/CR1738AV799fed-16.jpg,DOLCE & GABBANA,241450NSD000008-8B956,Spring - Summer,2024,CR1738 AV799,8B956,Nero,NERO NERO,Italy,22%SE 46%VI 32%calf leather,Satin Mules With Metal Heel.,"These Dolce & Gabbana mules are characterized by criss-crossed bands in satin silk, lined with leather and a stiletto heel in metal with the DG logo. The insole is made of satin with patent edges and the sole is in leather.",Woman > Shoes > Mules,5,1150.0,44.00%,IT,36,"0,0,0,0,2,0,0,0,4,0,2,0,0,0,0,0,0,0,0,0,0,0,0,0,0,0,0,0",,,,,,,,"85.0 mm / 3.3""",0,8051200627292,790.0,2,241450NSD000008-8B956-36
https://www.styleisnow.com/business/mules-dolce-gabbana-241450nsd000008-8b956.html,,http://cdn.orderlink.it/foto/241450CR1738AV799/CR1738AV799ylm-13.jpg,http://cdn.orderlink.it/foto/241450CR1738AV799/CR1738AV799kvn-14.jpg,http://cdn.orderlink.it/foto/241450CR1738AV799/CR1738AV799fed-16.jpg,DOLCE & GABBANA,241450NSD000008-8B956,Spring - Summer,2024,CR1738 AV799,8B956,Nero,NERO NERO,Italy,22%SE 46%VI 32%calf leather,Satin Mules With Metal Heel.,"These Dolce & Gabbana mules are characterized by criss-crossed bands in satin silk, lined with leather and a stiletto heel in metal with the DG logo. The insole is made of satin with patent edges and the sole is in leather.",Woman > Shoes > Mules,1,1150.0,44.00%,IT,38,"0,0,0,0,2,0,0,0,4,0,2,0,0,0,0,0,0,0,0,0,0,0,0,0,0,0,0,0",,,,,,,,"85.0 mm / 3.3""",0,8051200627339,790.0,4,241450NSD000008-8B956-38
https://www.styleisnow.com/business/mules-dolce-gabbana-241450nsd000008-8b956.html,,http://cdn.orderlink.it/foto/241450CR1738AV799/CR1738AV799ylm-13.jpg,http://cdn.orderlink.it/foto/241450CR1738AV799/CR1738AV799kvn-14.jpg,http://cdn.orderlink.it/foto/241450CR1738AV799/CR1738AV799fed-16.jpg,DOLCE & GABBANA,241450NSD000008-8B956,Spring - Summer,2024,CR1738 AV799,8B956,Nero,NERO NERO,Italy,22%SE 46%VI 32%calf leather,Satin Mules With Metal Heel.,"These Dolce & Gabbana mules are characterized by criss-crossed bands in satin silk, lined with leather and a stiletto heel in metal with the DG logo. The insole is made of satin with patent edges and the sole is in leather.",Woman > Shoes > Mules,1,1150.0,44.00%,IT,39,"0,0,0,0,2,0,0,0,4,0,2,0,0,0,0,0,0,0,0,0,0,0,0,0,0,0,0,0",,,,,,,,"85.0 mm / 3.3""",0,8051200627353,790.0,2,241450NSD000008-8B956-39
https://www.styleisnow.com/business/backpacks-and-duffel-bags-carhartt-wip-241807fza000001-1ykxx.html,,http://cdn.orderlink.it/foto/241807I031468/I031468rhy-13.jpg,http://cdn.orderlink.it/foto/241807I031468/I031468uxo-14.jpg,http://cdn.orderlink.it/foto/241807I031468/I031468tkf-15.jpg,CARHARTT WIP,241807FZA000001-1YKXX,Spring - Summer,2024,I031468,1YKXX,Neutro,AGATE,Vietnam,100% PL (rec),Kickflip Backpack In Recycled Fabric,"Kickflip backpack from Carhartt made of waterproof technical canvas obtained from 100% recycled polyester fibers, with the iconic logo tag applied to the front and on the shoulder strap. Double-slider zipper closure, one side mesh pocket and one zippered pocket, tuck-buckles and skateboard straps on the front. Adjustable shoulder straps and padded back, technical fabric interior.",Man > Bags > Backpacks and Duffel bags,1,115.0,42.00%,-,os,2,4 cm,0,,,,,,0,,0,80.0,2,241807FZA000001-1YKXX-os
https://www.styleisnow.com/business/t-shirts-dsquared2-241431uts000019-100w.html,http://cdn.orderlink.it/foto/241431S71NL0086S23009/S71NL0086S23009lpj-20.jpg,http://cdn.orderlink.it/foto/241431S71NL0086S23009/S71NL0086S23009qjs-13.jpg,http://cdn.orderlink.it/foto/241431S71NL0086S23009/S71NL0086S23009fyk-14.jpg,http://cdn.orderlink.it/foto/241431S71NL0086S23009/S71NL0086S23009eqp-15.jpg,DSQUARED2,241431UTS000019-100W,Spring - Summer,2024,S71NL0086 S23009,100W,Bianco,WHITE,Italy,100%CO,"""Cotton Dsq2 Cool Tank","This Dsquared2 tank top is made of pure cotton jersey and features a printed DSQ2 logo in the center of the chest. The ribbed edges with stretch detailing highlight the round neckline and wide armholes. It has a regular fit and the model is 187 cm tall, wearing size L.",Man > Clothing > T-Shirts and Sweatshirts > T-shirts,1,370.0,52.00%,-,s,"1,1,3,0,0,0,0,0,0,0,0,0",,,,,,,,0,,8054148505332,260.0,3,241431UTS000019-100W-s
https://www.styleisnow.com/business/loafers-g-h-bass-241a22nmo000001-ocg.html,,http://cdn.orderlink.it/foto/232A22BA41010/BA41010otb-13.jpg,http://cdn.orderlink.it/foto/232A22BA41010/BA41010usc-14.jpg,http://cdn.orderlink.it/foto/232A22BA41010/BA41010czb-15.jpg,G.H. BASS,241A22NMO000001-OCG,Spring - Summer,2024,BA41010,OCG,Marrone,COGNAC,El Salvador,100% leather,Weejuns Penny Loafers,G.H. BASS Weejuns penny loafers handcrafted in leather. Leather interior and leather sole.,Woman > Shoes > Loafers,2,255.0,48.00%,IT,38,"0,0,0,0,0,0,0,2,3,1,0,1,0,0,0,0,0,0,0,0,0,0,0,0,0,0,0,0",,,,,,,,"20.0 mm / 0.8""",0,5051714795527,180.0,3,241A22NMO000001-OCG-38
https://www.styleisnow.com/business/sweatshirts-balmain-241007dfe000003-gab.html,http://cdn.orderlink.it/foto/241007CF1JO065BB02/CF1JO065BB02fmm-20.jpg,http://cdn.orderlink.it/foto/241007CF1JO065BB02/CF1JO065BB02zga-13.jpg,http://cdn.orderlink.it/foto/241007CF1JO065BB02/CF1JO065BB02zdq-14.jpg,http://cdn.orderlink.it/foto/241007CF1JO065BB02/CF1JO065BB02vmu-15.jpg,BALMAIN,241007DFE000003-GAB,Spring - Summer,2024,CF1JO065BB02,GAB,Bianco,BLANC NOIR,Portugal,100%CO,Cropped Sweatshirt With Flocked Logo,"Cropped sweatshirt by Balmain made from pure cotton french terry, enriched by Balmain Paris print on the chest. It features ribbed crew neck and cuffs. Loose fit. The model is 177 cm tall and wears size S.",Woman > Clothing > Tops and Sweatshirts > Sweatshirts,3,835.0,52.00%,-,m,"0,1,0,0,0,0,0,0,0",,,,,,,,0,,3615884624432,580.0,1,241007DFE000003-GAB-m
https://www.styleisnow.com/business/belts-versace-241417fcr000002-1b00v.html,,http://cdn.orderlink.it/foto/2314171003760DVTP1/1003760DVTP1gaa-13.jpg,http://cdn.orderlink.it/foto/2314171003760DVTP1/1003760DVTP1tln-14.jpg,http://cdn.orderlink.it/foto/2314171003760DVTP1/1003760DVTP1osf-15.jpg,VERSACE,241417FCR000002-1B00V,Spring - Summer,2024,1003760 DVTP1,1B00V,Nero,BLACK VERSACE GOLD,Italy,100% calf leather,Medusa Biggie Leather Belt,Versace leather belt with gold-tone metal Medusa Biggie buckle and a matching loop. Adjustable pin closure. The item in photo is size 100.,Man > Accessories > Belts,2,540.0,44.00%,CM,105,"0,0,0,0,0,0,3,6,8,5,0,0,0,0,0,0",,,0,3 cm,0,,0,0,,8052045706890,370.0,5,241417FCR000002-1B00V-105
https://www.styleisnow.com/business/sweatshirts-dsquared2-241431ufe000007-900.html,http://cdn.orderlink.it/foto/241431S74GU0763S25030/S74GU0763S25030yzb-20.jpg,http://cdn.orderlink.it/foto/241431S74GU0763S25030/S74GU0763S25030nxs-13.jpg,http://cdn.orderlink.it/foto/241431S74GU0763S25030/S74GU0763S25030shc-14.jpg,http://cdn.orderlink.it/foto/241431S74GU0763S25030/S74GU0763S25030rlj-15.jpg,DSQUARED2,241431UFE000007-900,Spring - Summer,2024,S74GU0763 S25030,900,Nero,BLACK,Italy,100%CO,Cipro Fit Hoodie,"Dsquared2 oversized sweatshirt featuring a drawstring hood and a small logo print detail at center chest. Made from fleece-back cotton jersey, it is finished with ribbed cuffs and hem. The model is 187 cm tall and wears a size L.",Man > Clothing > T-Shirts and Sweatshirts > Sweatshirts,4,630.0,52.00%,-,l,"4,4,2,2,0,0,0,0,0,0,0,0",,,,,,,,0,,8054148412708,430.0,4,241431UFE000007-900-l
