Product Url,Image,Image1,Image2,Image3,Vendor,Sku Styleisnow,Season,Year,SKU,Variant,Color detail,Color Supplier,Made in,Material,Product's Title,Description,Tags,Qty,Retail Price,Discount,Size,Qty Detail,Handle height,Shoulder bag length,Belt length,Belt height,Accessory length,Accessory height,Accessory weight,Heel height,Plateau height,Barcode,Compare to Price,Qty_Detail,SKU FULL
https://www.styleisnow.com/business/cufflinks-salvatore-ferragamo-232400fbg000002-001pl.html,,http://cdn.orderlink.it/foto/2324007702890751318/7702890751318ytx-13.jpg,http://cdn.orderlink.it/foto/2324007702890751318/7702890751318bae-14.jpg,http://cdn.orderlink.it/foto/2324007702890751318/7702890751318mrr-15.jpg,Ferragamo,232400FBG000002-001PL,Spring - Summer,2024,7702890751318,001PL,Argento,PALLADIO,Italy,100% BR,gancini tie clip,Ferragamo tie clip crafted in palladium-finished brass and characterized by Gancini decoration.,Man > Accessories > Jewellery > Cufflinks,2,320.0,52.00%,os,2,,,0.0,0,6 cm,1 cm,0,0,,8057553541087,220.0,2,232400FBG000002-001PL-os
https://www.styleisnow.com/business/maison-margiela-241098ypc000002-t8135.html,,http://cdn.orderlink.it/foto/241098SA3VX0011P4746/SA3VX0011P4746aqi-13.jpg,http://cdn.orderlink.it/foto/241098SA3VX0011P4746/SA3VX0011P4746ngk-14.jpg,http://cdn.orderlink.it/foto/241098SA3VX0011P4746/SA3VX0011P4746ftp-15.jpg,Maison Margiela,241098YPC000002-T8135,Spring - Summer,2024,SA3VX0011 P4746,T8135,Grigio,SMOKE,Italy,100% deer leather,leather cardholder,"Maison Mragiela credit card holder made of grained leather with three slots on each side, a center slit pocket and iconic Four Stitches on the back.",Unisex > Unisex accessories > Minuteria/slg,30,335.0,42.00%,os,7,,,0.0,0,8 cm,10 cm,0,0,,8053460602712,230.0,7,241098YPC000002-T8135-os
https://www.styleisnow.com/business/sweaters-isabel-marant-etoile-241409dfe000002-23ec.html,http://cdn.orderlink.it/foto/241409SW0001FAA3M01E/SW0001FAA3M01Eewb-20.jpg,http://cdn.orderlink.it/foto/241409SW0001FAA3M01E/SW0001FAA3M01Eyyl-13.jpg,http://cdn.orderlink.it/foto/241409SW0001FAA3M01E/SW0001FAA3M01Erwo-14.jpg,http://cdn.orderlink.it/foto/241409SW0001FAA3M01E/SW0001FAA3M01Eapo-15.jpg,Isabel Marant Etoile,241409DFE000002-23EC,Spring - Summer,2024,SW0001FA A3M01E,23EC,Grigio,ECRU,Portugal,88% CO 12 PL-R,mansel sweatshirt with metallic logo,"Marant Etoile sweatshirt crafted in organic cotton and recycled polyester french terry with metallic logo print on the chest. It features adjustable hood with drawstring, kangaroo pocket, ribbed hem and cuffs. Oversized fit with dropped shoulders. The model is 177 cm tall and wears size FR 36.",Woman > Clothing > Tops and Sweatshirts > Sweatshirts,6,435.0,42.00%,34,"0,5,6,7,0,0,0,0,0",,,,,,,,0,,3613615848485,300.0,5,241409DFE000002-23EC-34
https://www.styleisnow.com/business/pumps-jimmy-choo-241516nde000010-sprmx.html,,http://cdn.orderlink.it/foto/241516BINGPUMP65CBF/BINGPUMP65CBFxqt-13.jpg,http://cdn.orderlink.it/foto/241516BINGPUMP65CBF/BINGPUMP65CBFvgu-14.jpg,http://cdn.orderlink.it/foto/241516BINGPUMP65CBF/BINGPUMP65CBFrmu-16.jpg,Jimmy Choo,241516NDE000010-SPRMX,Spring - Summer,2024,BING PUMP 65 CBF,SPRMX,Rosa,SPRINKLE MIX,Italy,100% TR 100% leather,bing 65 pumps with glitter and crystals,"Bing pumps by Jimmy Choo covered in glitter and embellished with Swarovski crystal strap. Leather lining and insole with logo label, glittered heel, leather sole.",Woman > Shoes > Pumps,4,1185.0,48.00%,38,"0,0,0,0,0,0,0,0,3,0,2,0,1,0,0,0,0,0,0,0,0,0,0,0,0,0,0,0",,,,,,,,"65.0 mm / 2.6""",0,197255128204,820.0,3,241516NDE000010-SPRMX-38
https://www.styleisnow.com/business/sweaters-thom-browne-241976dma000002-100w.html,http://cdn.orderlink.it/foto/241976FKA445AY1024/FKA445AY1024dqp-20.jpg,http://cdn.orderlink.it/foto/241976FKA445AY1024/FKA445AY1024gpy-13.jpg,http://cdn.orderlink.it/foto/241976FKA445AY1024/FKA445AY1024qwg-14.jpg,http://cdn.orderlink.it/foto/241976FKA445AY1024/FKA445AY1024ehv-15.jpg,Thom Browne,241976DMA000002-100W,Spring - Summer,2024,FKA445AY1024,100W,Bianco,WHITE,Ireland,100%WV,pointelle stitch merino wool 4-bar sweater,"Crafted in pure merino wool pointelle knit, this crew-neck sweater features the emblematic 4-Bar intarsia motif at the left sleeve. Its wide ribbed bottom and cuffs are finished with buttoned splits revealing the signature RWB grosgrain trims. The dropped back hem is a signature Thom Browne touch. Regular fit. The model is 177 cm tall and wears a size IT 38.",Woman > Clothing > Knitwear > Sweaters,3,1105.0,57.00%,42,"0,0,0,0,2,0,0,0,0,0",,,,,,,,0,,197242859838,760.0,2,241976DMA000002-100W-42
https://www.styleisnow.com/business/vests-the-north-face-241754dge000001-rou.html,http://cdn.orderlink.it/foto/241754NF0A853O/NF0A853Oyrc-20.jpg,http://cdn.orderlink.it/foto/241754NF0A853O/NF0A853Ovwc-13.jpg,http://cdn.orderlink.it/foto/241754NF0A853O/NF0A853Obhk-14.jpg,http://cdn.orderlink.it/foto/241754NF0A853O/NF0A853Oxie-15.jpg,The North Face,241754DGE000001-ROU,Spring - Summer,2024,NF0A853O,ROU,Bianco,WHITE DUNE TNF BLACK,Bangladesh,"100%PL, 100%PL",saikuru puffer vest,"The North Face puffer vest crafted in water-repellent quilted micro ripstop with padding in recycled polyester fiber, characterized by contrasting yoke with embroidered logo at front and back. It features fleece-lined stand collar, zipper closure with logo puller, welt pockets with hidden zipper and elasticated hem. Lined and provided with an internal pocket. Regular fit. The model is 177 cm tall and wears size XS.",Woman > Clothing > Outerwear > Vests,1,245.0,42.00%,s,"0,0,2,0,2,0,0,0,0",,,,,,,,0,,196575591064,170.0,2,241754DGE000001-ROU-s
https://www.styleisnow.com/business/t-shirts-y-3-241589uts000014-black.html,http://cdn.orderlink.it/foto/241589IV8232/IV8232blc-20.jpg,http://cdn.orderlink.it/foto/241589IV8232/IV8232nqa-13.jpg,http://cdn.orderlink.it/foto/241589IV8232/IV8232fkr-14.jpg,http://cdn.orderlink.it/foto/241589IV8232/IV8232zai-15.jpg,Y-3,241589UTS000014-BLACK,Spring - Summer,2024,IV8232,BLACK,Nero,BLACK,Thailand,100% CO,long sleeve t-shirt,"This Y-3 long-sleeved t-shirt is made of pure cotton jersey and finished with a ribbed crew neck, side slits, and a tonal rubber logo detail on the chest. It has a loose fit and the model is 187 cm tall and wears size M.",Man > Clothing > T-Shirts and Sweatshirts > T-shirts,1,130.0,50.00%,l,"2,1,0,2,0,0,0,0,0,0,0,0",,,,,,,,0,,4067892747082,90.0,2,241589UTS000014-BLACK-l
https://www.styleisnow.com/business/flats-carel-241a03nfl000001-nrivr.html,,http://cdn.orderlink.it/foto/241A03CORAIL/CORAILvty-13.jpg,http://cdn.orderlink.it/foto/241A03CORAIL/CORAILsxc-14.jpg,http://cdn.orderlink.it/foto/241A03CORAIL/CORAILhck-16.jpg,Carel,241A03NFL000001-NRIVR,Spring - Summer,2024,CORAIL,NRIVR,Nero,NOIR IVOIRE,Italy,100% goat leather,mary jane coral lipstick,The Mary Jane Corail by Carel are made of soft nappa leather with contrasting profiles and an adjustable strap. The interior is lined with leather and the sole is made of leather as well.,Woman > Shoes > Flats > Flats,1,495.0,44.00%,39,"0,0,0,0,0,0,0,0,0,0,2,0,1,0,0,0,0,0,0,0,0,0,0,0,0,0,0,0",,,,,,,,"15.0 mm / 0.6""",0,3606101694147,340.0,2,241A03NFL000001-NRIVR-39
https://www.styleisnow.com/business/sneakers-common-projects-241659lsn000001-7547.html,,http://cdn.orderlink.it/foto/2216591528/1528uqf-13.jpg,http://cdn.orderlink.it/foto/2216591528/1528fqy-14.jpg,http://cdn.orderlink.it/foto/2216591528/1528tvv-16.jpg,Common Projects,241659LSN000001-7547,Fall - Winter,2024,1528,7547,Nero,BLACK,Italy,100% calf leather,original achilles low sneakers,"Original Achilles Low sneakers by Common Projectscrafted in smooth leatherwith gold-tone item number print on the side.Lace-up closure,leather lining and rubber sole. Spare laces included.",Man > Shoes > Sneakers,3,540.0,50.00%,40,"0,0,0,0,0,0,0,0,11,0,0,0,0,0,0,0,0,0,0,0,0,0,0,0,0,0,0",,,,,,,,"25.0 mm / 1.0""",0,0,370.0,11,241659LSN000001-7547-40
https://www.styleisnow.com/business/wallets-marc-jacobs-241445apg000006-046.html,,http://cdn.orderlink.it/foto/2414452F3SMP063S07/2F3SMP063S07ukj-13.jpg,http://cdn.orderlink.it/foto/2414452F3SMP063S07/2F3SMP063S07per-14.jpg,http://cdn.orderlink.it/foto/2414452F3SMP063S07/2F3SMP063S07mgl-15.jpg,Marc Jacobs,241445APG000006-046,Spring - Summer,2024,2F3SMP063S07,046,Grigio,WOLF GREY MULTI,Vietnam,100% cow leather,the utility snapshot top zip multi wallet,"Two-tone saffiano leather wallet by Marc Jacobs with silver metal monogram applied on front. Zippered closure, gusseted interior, four rear credit card slot and pull-out lobster clasp.  Silver-finished metalware.",Woman > Accessories > Wallets and Small Leather Goods > Wallets,1,195.0,50.00%,os,5,,,0.0,0,13 cm,"7,5 cm","2,5 cm",0,,196611090421,130.0,5,241445APG000006-046-os
https://www.styleisnow.com/business/wallets-comme-des-garcons-wallet-241694fpg000016-navy.html,,http://cdn.orderlink.it/foto/241694SA8100PD/SA8100PDryl-13.jpg,http://cdn.orderlink.it/foto/241694SA8100PD/SA8100PDluy-14.jpg,http://cdn.orderlink.it/foto/241694SA8100PD/SA8100PDtel-15.jpg,Comme Des Garcons Wallet,241694FPG000016-NAVY,Fall - Winter,2024,SA8100PD,NAVY,Blu,NAVY,Spain,100% cow hide,polka dot wallet,"The Comme des Garçons smooth leather wallet is decorated with a polka dot print and laminated logo lettering on the front. It features a top zip closure in gold, and a leather interior.",Man > Accessories > Wallets and small leather goods > Wallets,1,175.0,43.00%,os,3,,,0.0,0,15 cm,10 cm,"1,5 cm",0,,3607934207603,120.0,3,241694FPG000016-NAVY-os
https://www.styleisnow.com/business/t-shirts-boss-241249uts000002-260.html,http://cdn.orderlink.it/foto/24124950495742/50495742egg-20.jpg,http://cdn.orderlink.it/foto/24124950495742/50495742kte-13.jpg,http://cdn.orderlink.it/foto/24124950495742/50495742qng-14.jpg,http://cdn.orderlink.it/foto/24124950495742/50495742zaq-15.jpg,Boss,241249UTS000002-260,Spring - Summer,2024,50495742,260,Beige,MEDIUM BEIGE,Bangladesh,100% CO,tiburt 354 logo print t-shirt,Short-sleeved t-shirt in cotton jersey with macro Boss logo printed at the front. Finished with ribbed stretch crew neck. Regular fit. The model is 187 cm tall and wears a size L.,Man > Clothing > T-Shirts and Sweatshirts > T-shirts,1,105.0,51.99%,m,"2,2,0,1,0,0,0,0,0,0,0,0",,,,,,,,0,,4063537914826,70.0,2,241249UTS000002-260-m
https://www.styleisnow.com/business/one-pieces-the-attico-241837dco000009-035.html,http://cdn.orderlink.it/foto/241837243WBB04PA16/243WBB04PA16jfv-20.jpg,http://cdn.orderlink.it/foto/241837243WBB04PA16/243WBB04PA16azp-13.jpg,http://cdn.orderlink.it/foto/241837243WBB04PA16/243WBB04PA16zet-14.jpg,http://cdn.orderlink.it/foto/241837243WBB04PA16/243WBB04PA16obj-15.jpg,The Attico,241837DCO000009-035,Spring - Summer,2024,243WBB04PA16,035,Viola,PURPLE,Italy,80% PA 20% EA,ribbed lycra one-piece swims,The Attico one-piece swimsuit made of ribbed stretch lycra. It features a boat neckline and high-cut bottoms. Lined. The model is 177 cm tall and wears size S.,Woman > Clothing > Beachwear > One pieces,10,450.0,50.00%,m,"0,2,0,0,0,0,0,0,0",,,,,,,,0,,8053047339048,310.0,2,241837DCO000009-035-m
https://www.styleisnow.com/business/sandals-ugg-241357nsp000001-vrn.html,,http://cdn.orderlink.it/foto/2413571123572/1123572twm-13.jpg,http://cdn.orderlink.it/foto/2413571123572/1123572mzp-14.jpg,http://cdn.orderlink.it/foto/2413571123572/1123572ocf-16.jpg,Ugg,241357NSP000001-VRN,Fall - Winter,2024,1123572,VRN,Rosa,VIBRANT CORAL PINK LOTUS,Philippines,100% shearling,'scratchy,"'Upgrade your summer footwear with these UGG Scuffita slides, crafted from genuine sheepskin and featuring criss-cross straps and tonal suede inserts. The rubber sole provides durability and traction for all-day comfort. Elevate your casual look with these stylish and versatile slides.'",Woman > Shoes > Sandals,3,130.0,45.00%,36,"0,0,0,0,2,0,4,0,2,0,2,0,0,0,0,0,0,0,0,0,0,0,0,0,0,0,0,0",,,,,,,,0,0,197634001449,90.0,2,241357NSP000001-VRN-36
https://www.styleisnow.com/business/t-shirts-dsquared2-241431uts000016-100w.html,http://cdn.orderlink.it/foto/241431S71GD1393S23009/S71GD1393S23009gqx-20.jpg,http://cdn.orderlink.it/foto/241431S71GD1393S23009/S71GD1393S23009uwf-13.jpg,http://cdn.orderlink.it/foto/241431S71GD1393S23009/S71GD1393S23009blw-14.jpg,http://cdn.orderlink.it/foto/241431S71GD1393S23009/S71GD1393S23009emh-15.jpg,Dsquared2,241431UTS000016-100W,Spring - Summer,2024,S71GD1393 S23009,100W,Bianco,WHITE,Romania,100% CO,"""logoed cool fit t","This Dsquared2 crew neck t-shirt is made of pure cotton jersey with multicolored lettering printed on the chest. Finished with ribbing around the neckline, it has a regular fit. The model is 187 cm tall and wears size L.",Man > Clothing > T-Shirts and Sweatshirts > T-shirts,2,280.0,52.00%,l,"2,0,2,0,0,0,0,0,0,0,0,0",,,,,,,,0,,8054148447410,190.0,2,241431UTS000016-100W-l
https://www.styleisnow.com/business/sneakers-versace-241417lsn000002-1b000.html,,http://cdn.orderlink.it/foto/24141710144571A00389/10144571A00389fti-13.jpg,http://cdn.orderlink.it/foto/24141710144571A00389/10144571A00389fbm-14.jpg,http://cdn.orderlink.it/foto/24141710144571A00389/10144571A00389aui-16.jpg,Versace,241417LSN000002-1B000,Spring - Summer,2024,1014457 1A00389,1B000,Nero,BLACK,Italy,100% goat leather; 100% PA; 50%PL 50%PU,versace milano sneakers,"Low-top sneakers made of technical fabric with smooth leather and suede inserts, characterized by a jacquard Barocco pattern upper and tone-on-tone embroidered Versace Milano logo. Logo embossed on tongue, Medusa embossed on the heel tab, leather interior with removable insole and rubber sole.",Man > Shoes > Sneakers,1,580.0,44.00%,43,"0,0,0,0,0,0,0,0,2,0,1,0,2,0,3,0,4,0,0,0,0,0,0,0,0,0,0",,,,,,,,"35.0 mm / 1.4""",0,8056204934421,400.0,3,241417LSN000002-1B000-43
https://www.styleisnow.com/business/sneakers-versace-241417lsn000010-d0191.html,,http://cdn.orderlink.it/foto/211417DSU8094D18TCG/DSU8094D18TCGuvi-13.jpg,http://cdn.orderlink.it/foto/211417DSU8094D18TCG/DSU8094D18TCGexi-14.jpg,http://cdn.orderlink.it/foto/211417DSU8094D18TCG/DSU8094D18TCGtwk-16.jpg,Versace,241417LSN000010-D0191,Spring - Summer,2024,DSU8094 D18TCG,D0191,Bianco,WHITE GOLD,Italy,"100% PL, 100% calf leather",trigreca sneakers,"Versace Trigreca sneakers in technical fabric with multilayer inserts, leather details and contrasting graphic print. Trekking laces, golden Trigreca lettering on the tongue and heel, side print of Milan coordinates, Versace print on the front and side, front print with the Greek Key. Fabric interior with removable insole, rubber sole with side and back logo featuring the ""Greca Cushioning System"" made with the Greca motif on the sides, center and bottom with the iconic Medusa head in contrasting rubber.",Man > Shoes > Sneakers,1,965.0,44.00%,42,"0,0,0,0,0,0,0,0,1,0,3,0,3,0,2,0,2,0,0,0,0,0,0,0,0,0,0",,,,,,,,"40.0 mm / 1.6""",0,8053850660025,660.0,3,241417LSN000010-D0191-42
https://www.styleisnow.com/business/belts-versace-232417fcr000001-1b00v.html,,http://cdn.orderlink.it/foto/232417DCU41401A05029/DCU41401A05029rqv-13.jpg,http://cdn.orderlink.it/foto/232417DCU41401A05029/DCU41401A05029rfw-14.jpg,http://cdn.orderlink.it/foto/232417DCU41401A05029/DCU41401A05029emb-15.jpg,Versace,232417FCR000001-1B00V,Spring - Summer,2024,DCU4140 1A05029,1B00V,Nero,BLACK,Italy,100% calf leather,la medusa greca belt,Verace leather belt with Greca motiv all-over and gold metal Medua buckle. The item in photo is size 100.,Man > Accessories > Belts,3,565.0,50.00%,100,"0,0,0,0,0,0,15,30,31,9,0,0,0,0,0,0",,,0,4 cm,0,,0,0,,8054712501739,390.0,31,232417FCR000001-1B00V-100
https://www.styleisnow.com/business/sweatshirts-polo-ralph-lauren-241696dfe000011-dkvht.html,http://cdn.orderlink.it/foto/241696211935583005/211935583005hrj-20.jpg,http://cdn.orderlink.it/foto/241696211935583005/211935583005gwe-13.jpg,http://cdn.orderlink.it/foto/241696211935583005/211935583005qli-14.jpg,http://cdn.orderlink.it/foto/241696211935583005/211935583005wzm-15.jpg,Polo Ralph Lauren,241696DFE000011-DKVHT,Spring - Summer,2024,211935583005,DKVHT,Grigio,DARK VINTAGE HEATHER,Vietnam,100%CO,hooded sweatshirt with embroidered logo,"This Polo Ralph Lauren sweatshirt is made of soft cotton jersey with a brushed interior, featuring the iconic embroidered logo on the chest. It is finished with an adjustable drawstring hood, raglan sleeves, and ribbed edges, and has a regular fit. The model is 177 cm tall and wears size XS.",Woman > Clothing > Tops and Sweatshirts > Sweatshirts,1,230.0,48.00%,l,"4,0,0,0,0,0,0,0,0",,,,,,,,0,,3616537003116,160.0,4,241696DFE000011-DKVHT-l
https://www.styleisnow.com/business/ballet-flats-castaner-241652nes000003-115.html,,http://cdn.orderlink.it/foto/241652GEA2002/GEA2002zhg-13.jpg,http://cdn.orderlink.it/foto/241652GEA2002/GEA2002tvx-14.jpg,http://cdn.orderlink.it/foto/241652GEA2002/GEA2002dnl-16.jpg,Castaner,241652NES000003-115,Spring - Summer,2024,GEA 2 002,115,Celeste,CITADEL,Spain,100% CO,gea ballet flats espadrilles,"Gea handmade ballerina espadrilles by Castaner with canvas V-shaped upper and matching ribbon tied at the ankle. Wedge covered in braided rope, canvas and leather interior, rubber sole.",Woman > Shoes > Flats > Ballet flats,1,140.0,47.99%,39,"0,0,0,0,3,0,4,0,3,0,3,0,2,0,0,0,0,0,0,0,0,0,0,0,0,0,0,0",,,,,,,,"40.0 mm / 1.6""",2 cm,8434483851637,100.0,3,241652NES000003-115-39
https://www.styleisnow.com/business/tops-courreges-242030dto000003-9999.html,http://cdn.orderlink.it/foto/242030VESMTO042FI0001/VESMTO042FI0001xne-20.jpg,http://cdn.orderlink.it/foto/242030VESMTO042FI0001/VESMTO042FI0001huk-13.jpg,http://cdn.orderlink.it/foto/242030VESMTO042FI0001/VESMTO042FI0001ozj-14.jpg,http://cdn.orderlink.it/foto/242030VESMTO042FI0001/VESMTO042FI0001gyy-15.jpg,Courreges,242030DTO000003-9999,Fall - Winter,2024,VESMTO042FI0001,9999,Nero,BLACK,Bulgaria,70%VI 30%PL,"""ribbed knit tank top with pointed hem","The Courreges tank top is made of stretch viscose knit with ribbed detailing and features an asymmetrical hemline with a pointed front. It has a square neckline, tonal logo patch on the front, and a fitted silhouette. The model is 177 cm tall and wears size S.",Woman > Clothing > Tops and Sweatshirts > Tops,1,370.0,35.00%,m,"0,2,1,0,2,0,0,0,0",,,,,,,,0,,0,260.0,2,242030DTO000003-9999-m
https://www.styleisnow.com/business/loafers-valentino-garavani-242032nmo000004-0no.html,,http://cdn.orderlink.it/foto/2420325W2S0EU0BEK/5W2S0EU0BEKhhv-13.jpg,http://cdn.orderlink.it/foto/2420325W2S0EU0BEK/5W2S0EU0BEKuid-14.jpg,http://cdn.orderlink.it/foto/2420325W2S0EU0BEK/5W2S0EU0BEKmwu-16.jpg,Valentino Garavani,242032NMO000004-0NO,Fall - Winter,2024,5W2S0EU0BEK,0NO,Nero,NERO,Italy,100% calfskin,glossy leather vlogo signature loaf,"Valentino Garavani loafers made of shiny leather and adorned with the iconic VLogo Signature in antique brass effect. The lining and insole are made of leather, while the treaded sole is made of rubber.",Woman > Shoes > Loafers,2,1090.0,25.00%,39,"0,0,0,0,1,0,1,0,2,0,2,0,2,0,1,0,0,0,0,0,0,0,0,0,0,0,0,0",,,,,,,,"38.0 mm / 1.5""",0,0,750.0,2,242032NMO000004-0NO-39
https://www.styleisnow.com/business/polo-shirts-balmain-242007upl000001-0pa.html,http://cdn.orderlink.it/foto/242007DH1GB000JB82/DH1GB000JB82pjv-20.jpg,http://cdn.orderlink.it/foto/242007DH1GB000JB82/DH1GB000JB82obz-13.jpg,http://cdn.orderlink.it/foto/242007DH1GB000JB82/DH1GB000JB82jgd-14.jpg,http://cdn.orderlink.it/foto/242007DH1GB000JB82/DH1GB000JB82dyh-15.jpg,Balmain,242007UPL000001-0PA,Fall - Winter,2024,DH1GB000JB82,0PA,Nero,BLACK,Italy,97%CO 3%EA,polo shirt with pb labyrinth mon,"Balmain short-sleeved polo made of stretch cotton jacquard with an all-over PB labyrinth pattern. Classic ribbed collar, four-button silver metal closure engraved and side slits. Regular fit. The model is 187 cm tall and wears size L.",Man > Clothing > T-Shirts and Sweatshirts > Polo shirts,1,755.0,40.00%,xl,"2,2,1,1,0,0,0,0,0,0,0,0",,,,,,,,0,,0,520.0,1,242007UPL000001-0PA-xl
https://www.styleisnow.com/business/earrings-amina-muaddi-241729abg000003-bdcab.html,,http://cdn.orderlink.it/foto/222729MINIBEGUMEARRINGS/MINIBEGUMEARRINGSawy-13.jpg,http://cdn.orderlink.it/foto/222729MINIBEGUMEARRINGS/MINIBEGUMEARRINGSacp-14.jpg,http://cdn.orderlink.it/foto/222729MINIBEGUMEARRINGS/MINIBEGUMEARRINGSflv-15.jpg,Amina Muaddi,241729ABG000003-BDCAB,Spring - Summer,2024,MINI BEGUM EARRINGS BLACK,BDCAB,Grigio,BLACK DIAMOND CRYSTALS ANTIQUE SILVER BASE,Italy,55%CY 45%BR,begum e,"Amina Muaddi earrings made of antique silver-finished brass and embellished with crystals. Featuring the iconic Begum buckle shape. Butterfly back closure, suitable for pierced ears.",Woman > Accessories > Jewellery > Earrings,24,525.0,50.00%,os,28,,,0,0,"4,5 cm",4.5 cm,0,0,,8000000286406,360.0,28,241729ABG000003-BDCAB-os
https://www.styleisnow.com/business/sneakers-veja-242773nsn000012-exwbk.html,,http://cdn.orderlink.it/foto/221773CP0501537/CP0501537ywr-13.jpg,http://cdn.orderlink.it/foto/221773CP0501537/CP0501537dnz-14.jpg,http://cdn.orderlink.it/foto/221773CP0501537/CP0501537xfq-16.jpg,Veja,242773NSN000012-EXWBK,Fall - Winter,2024,CP0501537A,EXWBK,Bianco,EXTRA WHITE BLACK,Brazil,100% calf leather,campo sneakers,"Campo sneakers in Chromefree grain leather by Veja, featured by side V monogram in contrasting rubber and gold-tone side logo print. Contrasting heel tab, logo embossed on the tongue and on the back, interior in eco-sustainable fabric, natural rubber sole from the Amazon Forest.",Woman > Shoes > Sneakers,11,180.0,30.00%,38,"0,0,0,0,14,0,17,0,17,0,22,0,25,0,0,0,0,0,0,0,0,0,0,0,0,0,0,0",,,,,,,,"30.0 mm / 1.2""",0,0,120.0,17,242773NSN000012-EXWBK-38
https://www.styleisnow.com/business/sneakers-alexander-mcqueen-242527nsn000001-9061.html,,http://cdn.orderlink.it/foto/191527553770WHGP7/553770WHGP7qpt-13.jpg,http://cdn.orderlink.it/foto/201527553770WHGP7/553770WHGP7mbj-14.jpg,http://cdn.orderlink.it/foto/191527553770WHGP7/553770WHGP7sus-15.jpg,Alexander Mcqueen,242527NSN000001-9061,Fall - Winter,2024,553770 WHGP7,9061,Bianco,WHITE BLACK,Italy,100% vitello,oversized sneakers,"Alexander McQueen leather sneakers with oversized rubber sole and leather lining with removable insole. Contrast suede heel detail, polished metal eyelets, gold-printed logo on the tongue and on the back, perforated sides. They feature extra laces.",Woman > Shoes > Sneakers,26,640.0,22.00%,36,"0,0,0,0,28,0,79,0,86,0,103,0,57,0,4,0,0,0,0,0,0,0,0,0,0,0,0,0",,,,,,,,"40.0 mm / 1.6""",0,0,440.0,28,242527NSN000001-9061-36
https://www.styleisnow.com/business/sneakers-alexander-mcqueen-242527nsn000001-9061.html,,http://cdn.orderlink.it/foto/191527553770WHGP7/553770WHGP7qpt-13.jpg,http://cdn.orderlink.it/foto/201527553770WHGP7/553770WHGP7mbj-14.jpg,http://cdn.orderlink.it/foto/191527553770WHGP7/553770WHGP7sus-15.jpg,Alexander Mcqueen,242527NSN000001-9061,Fall - Winter,2024,553770 WHGP7,9061,Bianco,WHITE BLACK,Italy,100% vitello,oversized sneakers,"Alexander McQueen leather sneakers with oversized rubber sole and leather lining with removable insole. Contrast suede heel detail, polished metal eyelets, gold-printed logo on the tongue and on the back, perforated sides. They feature extra laces.",Woman > Shoes > Sneakers,77,640.0,22.00%,37,"0,0,0,0,28,0,79,0,86,0,103,0,57,0,4,0,0,0,0,0,0,0,0,0,0,0,0,0",,,,,,,,"40.0 mm / 1.6""",0,0,440.0,79,242527NSN000001-9061-37
https://www.styleisnow.com/business/sneakers-alexander-mcqueen-242527nsn000001-9061.html,,http://cdn.orderlink.it/foto/191527553770WHGP7/553770WHGP7qpt-13.jpg,http://cdn.orderlink.it/foto/201527553770WHGP7/553770WHGP7mbj-14.jpg,http://cdn.orderlink.it/foto/191527553770WHGP7/553770WHGP7sus-15.jpg,Alexander Mcqueen,242527NSN000001-9061,Fall - Winter,2024,553770 WHGP7,9061,Bianco,WHITE BLACK,Italy,100% vitello,oversized sneakers,"Alexander McQueen leather sneakers with oversized rubber sole and leather lining with removable insole. Contrast suede heel detail, polished metal eyelets, gold-printed logo on the tongue and on the back, perforated sides. They feature extra laces.",Woman > Shoes > Sneakers,84,640.0,22.00%,38,"0,0,0,0,28,0,79,0,86,0,103,0,57,0,4,0,0,0,0,0,0,0,0,0,0,0,0,0",,,,,,,,"40.0 mm / 1.6""",0,0,440.0,86,242527NSN000001-9061-38
https://www.styleisnow.com/business/sneakers-alexander-mcqueen-242527nsn000001-9061.html,,http://cdn.orderlink.it/foto/191527553770WHGP7/553770WHGP7qpt-13.jpg,http://cdn.orderlink.it/foto/201527553770WHGP7/553770WHGP7mbj-14.jpg,http://cdn.orderlink.it/foto/191527553770WHGP7/553770WHGP7sus-15.jpg,Alexander Mcqueen,242527NSN000001-9061,Fall - Winter,2024,553770 WHGP7,9061,Bianco,WHITE BLACK,Italy,100% vitello,oversized sneakers,"Alexander McQueen leather sneakers with oversized rubber sole and leather lining with removable insole. Contrast suede heel detail, polished metal eyelets, gold-printed logo on the tongue and on the back, perforated sides. They feature extra laces.",Woman > Shoes > Sneakers,55,640.0,22.00%,40,"0,0,0,0,28,0,79,0,86,0,103,0,57,0,4,0,0,0,0,0,0,0,0,0,0,0,0,0",,,,,,,,"40.0 mm / 1.6""",0,0,440.0,57,242527NSN000001-9061-40
https://www.styleisnow.com/business/boots-isabel-marant-242441nsv000002-50ta.html,,http://cdn.orderlink.it/foto/232441BO0009FAA1A11S/BO0009FAA1A11Sjtl-13.jpg,http://cdn.orderlink.it/foto/232441BO0009FAA1A11S/BO0009FAA1A11Sbol-14.jpg,http://cdn.orderlink.it/foto/232441BO0009FAA1A11S/BO0009FAA1A11Sweu-16.jpg,Isabel Marant,242441NSV000002-50TA,Fall - Winter,2024,BO0009FA A1A11S,50TA,Beige,TAUPE,Portugal,100% calf leather,'susee' ankle boots,"Isabel Marant ""Susee"" ankle boots made of suede with leather interior and rubber sole.",Woman > Shoes > Boots and booties > Boots,3,755.0,35.00%,38,"0,0,0,0,2,0,1,0,3,0,3,0,1,0,0,0,0,0,0,0,0,0,0,0,0,0,0,0",,,,,,,,"30.0 mm / 1.2""",0,0,520.0,3,242441NSV000002-50TA-38
