Product Url,Image,Image1,Image2,Image3,Vendor,Sku Styleisnow,Season,Year,SKU,Variant,Color detail,Color Supplier,Made in,Material,Product's Title,Description,Tags,Qty,Retail Price,Discount,Size,Qty Detail,Handle height,Shoulder bag length,Belt length,Belt height,Accessory length,Accessory height,Accessory weight,Heel height,Plateau height,Barcode,Compare to Price,Qty_Detail,SKU FULL
https://www.styleisnow.com/business/boots-isabel-marant-242441nsv000001-50ta.html,,http://cdn.orderlink.it/foto/212441BO017400M015S/BO017400M015Szfk-13.jpg,http://cdn.orderlink.it/foto/212441BO017400M015S/BO017400M015Srxz-14.jpg,http://cdn.orderlink.it/foto/212441BO017400M015S/BO017400M015Svrz-16.jpg,Isabel Marant,242441NSV000001-50TA,Fall - Winter,2024,BO0002FA A1A03S,50TA,Beige,TAUPE,Portugal,100% calfskin,dewina boots,"Western style Dewina ankle boots by Isabel Marant in suede with side loops. Leather lining, contrasting leather sole.",Woman > Shoes > Boots and booties > Boots,1,635.0,35.00%,37,"0,0,0,0,1,0,3,0,3,0,0,0,1,0,0,0,0,0,0,0,0,0,0,0,0,0,0,0",,,,,,,,"45.0 mm / 1.8""",0,0,440.0,3,242441NSV000001-50TA-37
https://www.styleisnow.com/business/earrings-valentino-garavani-242032agl000007-k0w.html,,http://cdn.orderlink.it/foto/2420325W2J0E36QVS/5W2J0E36QVSivs-13.jpg,http://cdn.orderlink.it/foto/2420325W2J0E36QVS/5W2J0E36QVShcm-14.jpg,http://cdn.orderlink.it/foto/2420325W2J0E36QVS/5W2J0E36QVSnkz-15.jpg,Valentino Garavani,242032AGL000007-K0W,Fall - Winter,2024,5W2J0E36QVS,K0W,Argento,PALLADIUM/CREAM/CRYSTAL SILVER SHADE,Italy,100%BR 100%RE,vlogo signature earrings with swarovski®,"Valentino Garavani earrings with the iconic VLogo Signature shape in silver-plated brass, adorned with Swarovski&reg  crystals. They also feature a dangling resin pearl and have a butterfly closure for pierced ears.",Woman > Accessories > Jewellery > Earrings,1,580.0,25.00%,os,4,,,0,0,0,,0,0,,0,400.0,4,242032AGL000007-K0W-os
https://www.styleisnow.com/business/sneakers-veja-242773nsn000006-exwbs.html,,http://cdn.orderlink.it/foto/242773VX0503138A/VX0503138Asyx-13.jpg,http://cdn.orderlink.it/foto/242773VX0503138A/VX0503138Abjd-14.jpg,http://cdn.orderlink.it/foto/242773VX0503138A/VX0503138Amag-16.jpg,Veja,242773NSN000006-EXWBS,Fall - Winter,2024,VX0503138A,EXWBS,Bianco,EXTRA WHITE BLACK SAHARA,Brazil,100%leather 100%TR,v-10 sneakers,"Veja V-10 made of Chromefree leather with suede inserts and characterized by contrasting rubber logo side V monogram and logoed heel tab. Embossed logo on tongue, eco-friendly fabric interior with removable insole, natural rubber sole with sourced from the Amazon Rainforest.",Woman > Shoes > Sneakers,6,200.0,30.00%,39,"0,0,0,0,2,0,4,0,3,0,6,0,4,0,1,0,0,0,0,0,0,0,0,0,0,0,0,0",,,,,,,,"30.0 mm / 1.2""",0,0,140.0,6,242773NSN000006-EXWBS-39
https://www.styleisnow.com/business/t-shirts-and-polo-shirts-courreges-242030dts000002-9901.html,http://cdn.orderlink.it/foto/241030PERJTS017JS0070/PERJTS017JS0070xeg-20.jpg,http://cdn.orderlink.it/foto/241030PERJTS017JS0070/PERJTS017JS0070hmp-13.jpg,http://cdn.orderlink.it/foto/241030PERJTS017JS0070/PERJTS017JS0070ngh-14.jpg,http://cdn.orderlink.it/foto/241030PERJTS017JS0070/PERJTS017JS0070hns-15.jpg,Courreges,242030DTS000002-9901,Fall - Winter,2024,VESJTS017JS0070,9901,Nero,BLACK/HERITAGE WHITE,Portugal,100%CO,re-edition t-shirt with contrast trims,Courrèges crew-neck T-shirt in pure cotton jersey with an AC logo patch embroidered at chest and contrast trims. Slim fit. The model is 177 cm tall and wears size S.,Woman > Clothing > Tops and Sweatshirts > T-shirts and Polo shirts,1,245.0,35.00%,m,"0,2,0,0,1,0,0,0,0",,,,,,,,0,,0,170.0,2,242030DTS000002-9901-m
https://www.styleisnow.com/business/t-shirts-and-polo-shirts-courreges-242030dts000002-9901.html,http://cdn.orderlink.it/foto/241030PERJTS017JS0070/PERJTS017JS0070xeg-20.jpg,http://cdn.orderlink.it/foto/241030PERJTS017JS0070/PERJTS017JS0070hmp-13.jpg,http://cdn.orderlink.it/foto/241030PERJTS017JS0070/PERJTS017JS0070ngh-14.jpg,http://cdn.orderlink.it/foto/241030PERJTS017JS0070/PERJTS017JS0070hns-15.jpg,Courreges,242030DTS000002-9901,Fall - Winter,2024,VESJTS017JS0070,9901,Nero,BLACK/HERITAGE WHITE,Portugal,100%CO,re-edition t-shirt with contrast trims,Courrèges crew-neck T-shirt in pure cotton jersey with an AC logo patch embroidered at chest and contrast trims. Slim fit. The model is 177 cm tall and wears size S.,Woman > Clothing > Tops and Sweatshirts > T-shirts and Polo shirts,2,245.0,35.00%,xs,"0,2,0,0,1,0,0,0,0",,,,,,,,0,,0,170.0,1,242030DTS000002-9901-xs
https://www.styleisnow.com/business/t-shirts-kenzo-242416uts000003-99j.html,http://cdn.orderlink.it/foto/242416FE65TS4754SO/FE65TS4754SOfsx-20.jpg,http://cdn.orderlink.it/foto/242416FE65TS4754SO/FE65TS4754SOymc-13.jpg,http://cdn.orderlink.it/foto/242416FE65TS4754SO/FE65TS4754SOscw-14.jpg,http://cdn.orderlink.it/foto/242416FE65TS4754SO/FE65TS4754SOmxp-15.jpg,Kenzo,242416UTS000003-99J,Fall - Winter,2024,FE65TS4754SO,99J,Nero,BLACK,Portugal,100%CO,"""boke flower printed t-shirt","Kenzo crew neck t-shirt with large Boke Flower print on the front. Made of lightweight cotton jersey, it has a relaxed fit with ribbed neckline. The model is 187 cm tall and wears size L.",Man > Clothing > T-Shirts and Sweatshirts > T-shirts,3,195.0,35.00%,l,"4,3,1,2,0,0,0,0,0,0,0,0",,,,,,,,0,,0,130.0,4,242416UTS000003-99J-l
https://www.styleisnow.com/business/sneakers-veja-242773lsn000032-bkwhn.html,,http://cdn.orderlink.it/foto/241773VO0103529A/VO0103529Adhn-13.jpg,http://cdn.orderlink.it/foto/241773VO0103529A/VO0103529Axmf-14.jpg,http://cdn.orderlink.it/foto/241773VO0103529A/VO0103529Afnx-16.jpg,Veja,242773LSN000032-BKWHN,Fall - Winter,2024,VO0103529B,BKWHN,Nero,BLACK WHITE NATURAL,Brazil,100% CO,volleyball sne,"Veja's Volley sneakers are made from organic cotton with smooth leather and suede inserts in matching tones. They feature a front lace-up closure, embroidered logo patch on the tongue, and a lined interior with a removable insole. The iconic V is highlighted in contrast on the rubber sole, which is made from Amazonian rubber.",Man > Shoes > Sneakers,1,160.0,30.00%,42,"0,0,0,0,0,0,0,0,1,0,2,0,2,0,2,0,2,0,0,0,0,0,0,0,0,0,0",,,,,,,,"20.0 mm / 0.8""",0,0,110.0,2,242773LSN000032-BKWHN-42
https://www.styleisnow.com/business/sneakers-golden-goose-242571nsn000002-81482.html,,http://cdn.orderlink.it/foto/221571GWF00102F002435/GWF00102F002435jkk-13.jpg,http://cdn.orderlink.it/foto/221571GWF00102F002435/GWF00102F002435ilr-14.jpg,http://cdn.orderlink.it/foto/221571GWF00102F002435/GWF00102F002435pux-16.jpg,Golden Goose,242571NSN000002-81482,Fall - Winter,2024,GWF00102 F002435,81482,Bianco,WHITE/ICE/ORCHID PINK/SILVER,Italy,100% bovine leather,"""classic leather super-star sneakers", ,Woman > Shoes > Sneakers,1,615.0,30.00%,36,"0,0,0,0,2,0,2,0,0,0,1,0,0,0,1,0,0,0,0,0,0,0,0,0,0,0,0,0",,,,,,,,"35.0 mm / 1.4""",0,0,420.0,2,242571NSN000002-81482-36
https://www.styleisnow.com/business/ballet-flats-valentino-garavani-242032nfl000002-0no.html,,http://cdn.orderlink.it/foto/2420325W2S0JV2EEY/5W2S0JV2EEYpgj-13.jpg,http://cdn.orderlink.it/foto/2420325W2S0JV2EEY/5W2S0JV2EEYgse-14.jpg,http://cdn.orderlink.it/foto/2420325W2S0JV2EEY/5W2S0JV2EEYrxb-16.jpg,Valentino Garavani,242032NFL000002-0NO,Fall - Winter,2024,5W2S0JV2EEY,0NO,Nero,NERO,Italy,100% calf leather,vlogo locker mary-jane,"These Valentino Garavani Mary-Jane ballerina shoes are made of smooth leather with a VLogo Signature buckle closure in light gold finish. The interior is lined with leather, and the heel features a foldable nappa detail. The sole is made of leather for added comfort and durability.",Woman > Shoes > Flats > Ballet flats,3,1140.0,25.00%,39,"0,0,0,0,2,0,2,0,4,0,4,0,2,0,1,0,0,0,0,0,0,0,0,0,0,0,0,0",,,,,,,,0,0,0,790.0,4,242032NFL000002-0NO-39
https://www.styleisnow.com/business/tops-self-portrait-242632dto000008-pink.html,http://cdn.orderlink.it/foto/242632PF24127TP/PF24127TPoat-20.jpg,http://cdn.orderlink.it/foto/242632PF24127TP/PF24127TPqyw-13.jpg,http://cdn.orderlink.it/foto/242632PF24127TP/PF24127TPolp-14.jpg,http://cdn.orderlink.it/foto/242632PF24127TP/PF24127TPyqe-15.jpg,Self-Portrait,242632DTO000008-PINK,Fall - Winter,2024,PF24 127T P,PINK,Rosa,PINK,China,41%VI 39%PA 20%CO,knitted crop top in mesh,"This short-sleeved crop top by Self-Portrait is made of a blend of cotton and viscose knit, embellished with micro sequins and adorned with jewel buttons on the front. It features a round neckline, button closure, and hidden snap pockets on the front. The fit is snug. The model is 177 cm tall and wears a size XS.",Woman > Clothing > Tops and Sweatshirts > Tops,1,415.0,32.00%,xs,"0,2,1,0,2,0,0,0,0",,,,,,,,0,,0,290.0,2,242632DTO000008-PINK-xs
https://www.styleisnow.com/business/mini-self-portrait-242632dgn000006-pink.html,http://cdn.orderlink.it/foto/242632PF24128SKP/PF24128SKPuau-20.jpg,http://cdn.orderlink.it/foto/242632PF24128SKP/PF24128SKPlyj-13.jpg,http://cdn.orderlink.it/foto/242632PF24128SKP/PF24128SKPwkx-14.jpg,http://cdn.orderlink.it/foto/242632PF24128SKP/PF24128SKPmth-15.jpg,Self-Portrait,242632DGN000006-PINK,Fall - Winter,2024,PF24 128SK P,PINK,Rosa,PINK,China,41%VI 39%PA 20%CO,"""knitted mini skirt with jewel buttons","This Self-Portrait miniskirt is made of a blend of cotton and viscose knit, embellished with micro sequins and adorned with decorative jewel buttons on the front. It features hidden snap pockets on the front and a fitted silhouette enhanced by a high waist. The model is 177 cm tall and wears a size XS.",Woman > Clothing > Skirts > Mini,1,405.0,32.00%,xs,"0,2,1,0,2,0,0,0,0",,,,,,,,0,,0,280.0,2,242632DGN000006-PINK-xs
https://www.styleisnow.com/business/pumps-jimmy-choo-242516nde000041-blck.html,,http://cdn.orderlink.it/foto/231516LOVE65PWJ/LOVE65PWJgvh-13.jpg,http://cdn.orderlink.it/foto/231516LOVE65PWJ/LOVE65PWJfdn-14.jpg,http://cdn.orderlink.it/foto/231516LOVE65PWJ/LOVE65PWJseh-16.jpg,Jimmy Choo,242516NDE000041-BLCK,Fall - Winter,2024,LOVE 65 PWJ,BLCK,Nero,BLACK,Italy,100% calf leather,love 65 pumps,"Jimmy Choo Love pumps crafted patent leather with golden metal JC monogram. Leather lining, leather sole.",Woman > Shoes > Pumps,1,865.0,28.00%,40,"0,0,0,0,1,0,2,0,3,0,3,0,2,0,1,0,0,0,0,0,0,0,0,0,0,0,0,0",,,,,,,,"65.0 mm / 2.6""",0,192954532321,600.0,2,242516NDE000041-BLCK-40
https://www.styleisnow.com/business/sneakers-tod-s-242727nsn000002-9999a.html,,http://cdn.orderlink.it/foto/242727XXW54C0IP13TT4/XXW54C0IP13TT4nzr-13.jpg,http://cdn.orderlink.it/foto/242727XXW54C0IP13TT4/XXW54C0IP13TT4tgc-14.jpg,http://cdn.orderlink.it/foto/242727XXW54C0IP13TT4/XXW54C0IP13TT4nqr-16.jpg,Tod'S,242727NSN000002-9999A,Fall - Winter,2024,XXW54C0IP13TT4,9999A,Grigio,ALTRAVERSIONE,Italy,27% WM 34% PC 12% EA 27% PA,"""knit kate sneakers","These Tod's slip-on sneakers are made of a mohair blend knit with leather chain detail. The interior is unlined with a removable insole, and features a leather back pull tab and chunky rubber sole.",Woman > Shoes > Sneakers,1,885.0,35.00%,35,"0,0,1,0,2,0,2,0,2,0,1,0,0,0,0,0,0,0,0,0,0,0,0,0,0,0,0,0",,,,,,,,"40.0 mm / 1.6""",0,0,610.0,1,242727NSN000002-9999A-35
https://www.styleisnow.com/business/sweatshirts-maison-kitsune-242684ufe000003-h120.html,http://cdn.orderlink.it/foto/241684LM00702KM0001/LM00702KM0001utv-20.jpg,http://cdn.orderlink.it/foto/241684LM00702KM0001/LM00702KM0001gqu-13.jpg,http://cdn.orderlink.it/foto/241684LM00702KM0001/LM00702KM0001fmh-14.jpg,http://cdn.orderlink.it/foto/241684LM00702KM0001/LM00702KM0001vtz-15.jpg,Maison Kitsune,242684UFE000003-H120,Fall - Winter,2024,LM00702KM0001,H120,Grigio,LIGHT GREY MELANGE,Portugal,100%CO,fox head hooded sweatshirt,"Classically designed with a drawstring hood and kangaroo pocket, this sweatshirt from Maison Kitsuné features the signature Fox Head patch embroidered at the chest. It is crafted from loopback cotton jersey to a regular fit with dropped shoulders and ribbed cuffs and hem. The model is 187 cm tall and wears a size L.",Man > Clothing > T-Shirts and Sweatshirts > Sweatshirts,7,270.0,30.00%,l,"8,8,6,4,0,0,0,0,0,0,0,0",,,,,,,,0,,0,190.0,8,242684UFE000003-H120-l
https://www.styleisnow.com/business/mules-birkenstock-242568xsp000060-black.html,,http://cdn.orderlink.it/foto/241568127103/127103tvs-13.jpg,http://cdn.orderlink.it/foto/241568127103/127103drp-14.jpg,http://cdn.orderlink.it/foto/241568127103/127103jll-16.jpg,Birkenstock,242568XSP000060-BLACK,Fall - Winter,2024,127103,BLACK,Nero,BLACK,Germany,100% EVA,eva boston sabot narrow fit,BIRKENSTOCK Boston EVA with tone-on-tone adjustable strap. Narrow fit. 	,Woman > Shoes > Mules,16,90.0,25.00%,37,"0,0,6,0,17,0,18,0,18,0,17,0,6,0,0,0,0,0,0,0,0,0,0,0,0",,,,,,,,0,0,0,60.0,17,242568XSP000060-BLACK-37
https://www.styleisnow.com/business/sneakers-golden-goose-242571nsn000005-11932.html,,http://cdn.orderlink.it/foto/242571GWF00118F006186/GWF00118F006186vqe-13.jpg,http://cdn.orderlink.it/foto/242571GWF00118F006186/GWF00118F006186lme-14.jpg,http://cdn.orderlink.it/foto/242571GWF00118F006186/GWF00118F006186ejv-16.jpg,Golden Goose,242571NSN000005-11932,Fall - Winter,2024,GWF00118 F006186,11932,Bianco,WHITE/BUTTER/BRONZE,Italy,93%ovine leather 7%cow leather,classic hi star sneakers in,"The Golden Goose Hi Star Classic sneakers are made of smooth leather with a side star in crocodile print leather and a laminated spoiler. The tongue features lettering print, while the interior is lined with leather and sponge and has a removable insole. The rubber sole showcases hand-written lettering along the edge.",Woman > Shoes > Sneakers,1,695.0,30.00%,39,"0,0,0,0,2,0,3,0,2,0,2,0,1,0,0,0,0,0,0,0,0,0,0,0,0,0,0,0",,,,,,,,"35.0 mm / 1.4""",0,0,480.0,2,242571NSN000005-11932-39
https://www.styleisnow.com/business/belts-versace-242417acr000003-1b00v.html,,http://cdn.orderlink.it/foto/2424171005786DV3T/1005786DV3Tmcm-13.jpg,http://cdn.orderlink.it/foto/2424171005786DV3T/1005786DV3Tzdz-14.jpg,,Versace,242417ACR000003-1B00V,Fall - Winter,2024,1005786 DV3T,1B00V,Nero,BLACK-VERSACE GOLD,Italy,100% calfskin,leather safety pin belt,"Crafted in smooth leather, this Versace belt is embellished with a gold-tone Safety Pin buckle. The contrasting interior adds an extra touch of style. The item pictured corresponds to size 90.",Woman > Accessories > Belts,1,475.0,32.00%,90,"0,0,0,0,2,2,2,1,0,0,0,0,0",,,0.0,0,0,,0,0,,0,330.0,2,242417ACR000003-1B00V-90
https://www.styleisnow.com/business/books-assouline-ogg961oli000076-vabb.html,,http://cdn.orderlink.it/foto/OGG9619781649803412/9781649803412sgb-13.jpg,http://cdn.orderlink.it/foto/OGG9619781649803412/9781649803412kbn-14.jpg,,Assouline,OGG961OLI000076-VABB,Spring - Summer,20OG,9781649803412,VABB,Rosa,VARIANTE ABBINATA,Italy,0,budapest jewel,"In addition to its rich history, Budapest pulsates with a dynamic present, characterized by cultural fusion and creative fervor. Artists, filmmakers, and innovators thrive here, blending nostalgia with a forward-thinking energy. Budapest Gem, featuring original photographs by Oliver Pilcher, captures the essence of the city, inspiring readers with its timeless charm. Published by Assouline.",Beauty and Lifestyle > Lifestyle > Books,3,135.0,0%,os,4,0.0,0.0,0.0,0,0,,0,0,0,0,90.0,4,OGG961OLI000076-VABB-os
https://www.styleisnow.com/business/sandals-birkenstock-242568xsp000009-thyme.html,,http://cdn.orderlink.it/foto/2425681025367/1025367srj-13.jpg,http://cdn.orderlink.it/foto/2425681025367/1025367mlf-14.jpg,http://cdn.orderlink.it/foto/2425681025367/1025367jmy-16.jpg,Birkenstock,242568XSP000009-THYME,Fall - Winter,2024,1025367,THYME,Verde,THYME,Germany,100% leather,big buckle arizona slides,"BIRKENSTOCK Arizona slides crafted in oiled nabuck leather featuring double adjustable strap with oversize gold-finished metal buckle featuring debossed logo. Smooth leather footbed, moulded cork and latex sole and EVA tread. Narrow fit.",Woman > Shoes > Sandals,1,165.0,25.00%,36,"0,0,2,0,0,0,1,0,0,0,3,0,1,0,0,0,0,0,0,0,0,0,0,0,0",,,,,,,,0,0,0,120.0,2,242568XSP000009-THYME-36
https://www.styleisnow.com/business/sneakers-y-3-242589lsn000007-a0009.html,,http://cdn.orderlink.it/foto/242589IH0865/IH0865ffu-13.jpg,http://cdn.orderlink.it/foto/242589IH0865/IH0865mhp-14.jpg,http://cdn.orderlink.it/foto/242589IH0865/IH0865bur-16.jpg,Y-3,242589LSN000007-A0009,Fall - Winter,2024,IH0865,A0009,Nero,CBLACK/CBLACK/OWHITE,China,100% TR,adizero adios pro,"The Adizero Adios Pro 3 sneakers by Y-3 are made of breathable technical fabric and feature the iconic three side stripes. They boast ENERGYRODS 2.0 carbon elements for lightness and stiffness, LIGHTSTRIKE PRO cushioning with two layers of more durable material, and a thin CONTINENTAL&trade  rubber sole for unbeatable grip.",Man > Shoes > Sneakers,3,450.0,35.00%,9,"0,0,0,0,1,2,2,3,1,1,0,0,0,0,0,0,0,0,0,0,0,0,0,0,0,0,0",,,,,,,,"40.0 mm / 1.6""",0,0,310.0,3,242589LSN000007-A0009-9
https://www.styleisnow.com/business/winter-boots-ugg-242357nsv000007-che.html,,http://cdn.orderlink.it/foto/2423571116109/1116109fjn-13.jpg,http://cdn.orderlink.it/foto/2423571116109/1116109gct-14.jpg,http://cdn.orderlink.it/foto/2423571116109/1116109vph-16.jpg,Ugg,242357NSV000007-CHE,Fall - Winter,2024,1116109,CHE,Marrone,CHESTNUT,Vietnam,"100% leather, 100% shearling",classic ultra mini ankle boots,"UGG Classic Ultra Mini boots crafted in stain and water resistant suede leather with raised stitching, soft sheepskin lining, leather patch with debossed logo applied on the heel and rear loop. Sheepskin insole and Treadlite rubber sole.",Woman > Shoes > Boots and booties > Winter boots,1,220.0,29.99%,7,"0,0,0,0,4,0,2,0,2,0,0,0,1,0,0,0,0",,,,,,,,0,0,0,150.0,2,242357NSV000007-CHE-7
https://www.styleisnow.com/business/shirts-polo-ralph-lauren-242696ucw000011-003be.html,http://cdn.orderlink.it/foto/242696710928255003/710928255003bkr-20.jpg,http://cdn.orderlink.it/foto/242696710928255003/710928255003jaq-13.jpg,http://cdn.orderlink.it/foto/242696710928255003/710928255003oqc-14.jpg,http://cdn.orderlink.it/foto/242696710928255003/710928255003alm-15.jpg,Polo Ralph Lauren,242696UCW000011-003BE,Fall - Winter,2024,710928255003,003BE,Blu,2865 BLUE END ON END,Indonesia,91% CO 9% EL,custom fit cotton stretch shirt,"This Polo Ralph Lauren cotton stretch shirt features a button-down collar, barrel cuffs, rounded hemline, and back yoke with pleat. The iconic Pony logo is embroidered on the chest. Custom Fit. The model is 187 cm tall and wears size L.",Man > Clothing > Shirts,2,190.0,30.00%,xl,"4,4,3,3,0,0,0,0,0,0,0,0",,,,,,,,0,,0,130.0,3,242696UCW000011-003BE-xl
https://www.styleisnow.com/business/mules-birkenstock-242568xsp000035-a0005.html,,http://cdn.orderlink.it/foto/2425681028031/1028031dsj-13.jpg,http://cdn.orderlink.it/foto/2425681028031/1028031oxv-14.jpg,http://cdn.orderlink.it/foto/2425681028031/1028031ufv-16.jpg,Birkenstock,242568XSP000035-A0005,Fall - Winter,2024,1028031,A0005,Viola,ZINFANDEL,Germany,100% leather,madrid big buckle slides,"Madrid Big Buckle slides in oiled leather with gold-finished metal large buckle with debossed logo. Leather-covered semi-exquisit insole, anatomically shaped cork-latex footbed, EVA outsole. Regular fit.",Woman > Shoes > Mules,1,155.0,25.00%,40,"0,0,1,0,2,0,2,0,2,0,2,0,1,0,0,0,0,0,0,0,0,0,0,0,0",,,,,,,,0,0,0,110.0,2,242568XSP000035-A0005-40
https://www.styleisnow.com/business/cardigans-polo-ralph-lauren-242696ucd000001-003cm.html,http://cdn.orderlink.it/foto/242696710949808003/710949808003jjm-20.jpg,http://cdn.orderlink.it/foto/242696710949808003/710949808003qqx-13.jpg,http://cdn.orderlink.it/foto/242696710949808003/710949808003fmu-14.jpg,http://cdn.orderlink.it/foto/242696710949808003/710949808003jfh-15.jpg,Polo Ralph Lauren,242696UCD000001-003CM,Fall - Winter,2024,710949808003,003CM,Beige,CAMEL MELANGE,China,90%WO 10%WS,wool and cashmere braided cardigan,"This Polo Ralph Lauren cardigan is made in the iconic cable knit style with a blend of wool and cashmere. It features a V-neck, button closure, front flap pockets, ribbed cuffs with contrast trim, and the classic embroidered pony on the chest. The fit is regular. The model is 187 cm tall and wears size L.",Man > Clothing > Knitwear > Cardigans,1,320.0,30.00%,xl,"2,2,2,2,0,0,0,0,0,0,0,0",,,,,,,,0,,0,220.0,2,242696UCD000001-003CM-xl
https://www.styleisnow.com/business/wallets-and-small-leather-goods-comme-des-garcons-wallet-242694ypg000005-blck.html,,http://cdn.orderlink.it/foto/242694SA6400/SA6400ude-13.jpg,http://cdn.orderlink.it/foto/242694SA6400/SA6400clb-14.jpg,http://cdn.orderlink.it/foto/242694SA6400/SA6400ftj-15.jpg,Comme Des Garcons Wallet,242694YPG000005-BLCK,Fall - Winter,2024,SA6400,BLCK,Nero,BLACK,Spain,100% cowhide,leather compact wallet,Smooth leather mini wallet by COMME des GARÇONS with on bill compartment and two slit pockets,Unisex > Unisex accessories > Portafogli,5,110.0,30.00%,os,6,,,0.0,0,7 cm,"10,5 cm",0,0,,0,80.0,6,242694YPG000005-BLCK-os
https://www.styleisnow.com/business/sweatshirts-polo-ralph-lauren-241696dfe000009-ribpk.html,http://cdn.orderlink.it/foto/241696211935582002/211935582002tsh-20.jpg,http://cdn.orderlink.it/foto/241696211935582002/211935582002uyq-13.jpg,http://cdn.orderlink.it/foto/241696211935582002/211935582002ffx-14.jpg,http://cdn.orderlink.it/foto/241696211935582002/211935582002amw-15.jpg,Polo Ralph Lauren,241696DFE000009-RIBPK,Spring - Summer,2024,211935582002,RIBPK,Rosa,RIBBON PINK,Vietnam,100%CO,embroidered logo sweatshirt,This Polo Ralph Lauren crew neck sweatshirt is made of soft cotton jersey with a brushed interior. It features the iconic embroidered logo on the chest and is finished with a V detail at the neckline and ribbed edges. The regular fit makes it comfortable to wear. The model is 177 cm tall and wears size S.,Woman > Clothing > Tops and Sweatshirts > Sweatshirts,1,215.0,48.00%,s,"1,2,2,0,0,0,0,0,0",,,,,,,,0,,0,150.0,2,241696DFE000009-RIBPK-s
https://www.styleisnow.com/business/puffer-jackets-the-north-face-242754dpi000003-rou.html,http://cdn.orderlink.it/foto/232754NF0A5GGE/NF0A5GGEaui-20.jpg,http://cdn.orderlink.it/foto/232754NF0A5GGE/NF0A5GGEjdl-13.jpg,http://cdn.orderlink.it/foto/232754NF0A5GGE/NF0A5GGEgho-14.jpg,http://cdn.orderlink.it/foto/232754NF0A5GGE/NF0A5GGEkkd-15.jpg,The North Face,242754DPI000003-ROU,Fall - Winter,2024,NF0A5GGE,ROU,Bianco,WHITE DUNE/TNF BLACK,Vietnam,100%NY,'nuptse' cropped down jacket,"THE NORTH FACE two-tone cropped down jacket made from recycled ripstop nylon with a durable water-repellent finish and 700 RDS goose down padding. Cut to a boxy fit, it features a zip closure, colletto in piedi, side zip pockets, drawstring hem, and adjustable elasticated cuffs. Logo lettering embroidered on front and back. The model is 177 cm tall and wears a size XS.",Woman > Clothing > Outerwear > Puffer jackets,3,410.0,25.00%,m,"0,4,4,0,2,0,0,0,0",,,,,,,,0,,0,280.0,4,242754DPI000003-ROU-m
